A2: Shoves and Reshoves odds to call
A4: Note: If you don't see a hand on the botton of the chart, you need at least 2.5 to 1 odds.
A6: Note: If you don't see a hand on the top of the chart means you are favorite over that range.
A8: Tightest range (EP v EP 15-20 BBs): 5.13% - 99+, AQ+
B10: Equity | C10: Odds Needed
A11: TT | B11: 0.44259999999999999 | C11: =(100%-B11)/B11 -> 1.2593764121102575
A12: 99 | B12: 0.37459999999999999 | C12: =(100%-B12)/B12 -> 1.6695141484249867
A13: 88 | B13: 0.35639999999999999 | C13: =(100%-B13)/B13 -> 1.8058361391694724
A14: 77 | B14: 0.35549999999999998 | C14: =(100%-B14)/B14 -> 1.8129395218002815
A15: 66 | B15: 0.35670000000000002 | C15: =(100%-B15)/B15 -> 1.803476310625175
A16: 55 | B16: 0.35520000000000002 | C16: =(100%-B16)/B16 -> 1.8153153153153154
A17: 44 | B17: 0.35049999999999998 | C17: =(100%-B17)/B17 -> 1.8530670470756063
A18: 33 | B18: 0.34549999999999997 | C18: =(100%-B18)/B18 -> 1.8943560057887123
A19: 22 | B19: 0.33979999999999999 | C19: =(100%-B19)/B19 -> 1.9429075927015893
B22: Equity | C22: Odds Needed | F22: Equity | G22: Odds Needed | J22: Equity | K22: Odds Needed | N22: Equity | O22: Odds Needed | R22: Equity | S22: Odds Needed | V22: Equity | W22: Odds Needed | Z22: Equity | AA22: Odds Needed
A23: AQs | B23: 0.38940000000000002 | C23: =(100%-B23)/B23 -> 1.5680534155110426 | E23: KQs | F23: 0.33229999999999998 | G23: =(100%-F23)/F23 -> 2.0093289196509176 | I23: QJs | J23: 0.33329999999999999 | K23: =(100%-J23)/J23 -> 2.0003000300030007 | M23: JTs | N23: 0.33710000000000001 | O23: =(100%-N23)/N23 -> 1.9664787896766538 | Q23: T9s | R23: 0.31140000000000001 | S23: =(100%-R23)/R23 -> 2.2113037893384715 | U23: 98s | V23: 0.29780000000000001 | W23: =(100%-V23)/V23 -> 2.3579583613163195 | Y23: 76s | Z23: 0.30590000000000001 | AA23: =(100%-Z23)/Z23 -> 2.2690421706440009
A24: AJs | B24: 0.3342 | C24: =(100%-B24)/B24 -> 1.9922202274087371 | E24: KJs | F24: 0.34589999999999999 | G24: =(100%-F24)/F24 -> 1.8910089621277828 | I24: QTs | J24: 0.32119999999999999 | K24: =(100%-J24)/J24 -> 2.1133250311332508 | M24: J9s | N24: 0.31240000000000001 | O24: =(100%-N24)/N24 -> 2.2010243277848911 | Q24: T8s | R24: 0.30320000000000003 | S24: =(100%-R24)/R24 -> 2.2981530343007912 | U24: 97s | V24: 0.29289999999999999 | W24: =(100%-V24)/V24 -> 2.4141345168999662 | Y24: 75s | Z24: 0.29549999999999998 | AA24: =(100%-Z24)/Z24 -> 2.3840947546531304
A25: ATs | B25: 0.32140000000000002 | C25: =(100%-B25)/B25 -> 2.1113876789047912 | E25: KTs | F25: 0.33410000000000001 | G25: =(100%-F25)/F25 -> 1.9931158335827595 | I25: Q9s | J25: 0.29420000000000002 | K25: =(100%-J25)/J25 -> 2.3990482664853841 | M25: J8s | N25: 0.30420000000000003 | O25: =(100%-N25)/N25 -> 2.2873109796186717 | Q25: T7s | R25: 0.29459999999999997 | S25: =(100%-R25)/R25 -> 2.394433129667346 | U25: 96s | V25: 0.28499999999999998 | W25: =(100%-V25)/V25 -> 2.5087719298245621
A26: A9s | B26: 0.29920000000000002 | C26: =(100%-B26)/B26 -> 2.3422459893048124 | E26: K9s | F26: 0.30709999999999998 | G26: =(100%-F26)/F26 -> 2.2562683165092805 | I26: Q8s | J26: 0.28889999999999999 | K26: =(100%-J26)/J26 -> 2.4614053305642094 | M26: J7s | N26: 0.29530000000000001 | O26: =(100%-N26)/N26 -> 2.3863867253640363 | Q26: T6s | R26: 0.28560000000000002 | S26: =(100%-R26)/R26 -> 2.5014005602240892 | Y26: 65s | Z26: 0.30909999999999999 | AA26: =(100%-Z26)/Z26 -> 2.2351989647363317
A27: A8s | B27: 0.30230000000000001 | C27: =(100%-B27)/B27 -> 2.3079722130334104 | E27: K8s | F27: 0.30149999999999999 | G27: =(100%-F27)/F27 -> 2.3167495854063018 | M27: J6s | N27: 0.2863 | O27: =(100%-N27)/N27 -> 2.4928396786587497 | U27: 87s | V27: 0.30070000000000002 | W27: =(100%-V27)/V27 -> 2.3255736614566014 | Y27: 64s | Z27: 0.2954 | AA27: =(100%-Z27)/Z27 -> 2.3852403520649967
A28: A7s | B28: 0.3034 | C28: =(100%-B28)/B28 -> 2.2959789057350033 | E28: K7s | F28: 0.30409999999999998 | G28: =(100%-F28)/F28 -> 2.2883919763235778 | M28: J5s | N28: 0.2878 | O28: =(100%-N28)/N28 -> 2.4746351633078523 | U28: 86s | V28: 0.29399999999999998 | W28: =(100%-V28)/V28 -> 2.4013605442176869
A29: A6s | B29: 0.30159999999999998 | C29: =(100%-B29)/B29 -> 2.3156498673740056 | E29: K6s | F29: 0.30549999999999999 | G29: =(100%-F29)/F29 -> 2.2733224222585924 | Y29: 54s | Z29: 0.30790000000000001 | AA29: =(100%-Z29)/Z29 -> 2.2478077297823966
A30: A5s | B30: 0.31519999999999998 | C30: =(100%-B30)/B30 -> 2.1725888324873099 | E30: K5s | F30: 0.3039 | G30: =(100%-F30)/F30 -> 2.2905561039815727 | Y30: 53s | Z30: 0.29349999999999998 | AA30: =(100%-Z30)/Z30 -> 2.4071550255536627
A31: A4s | B31: 0.31140000000000001 | C31: =(100%-B31)/B31 -> 2.2113037893384715 | E31: K4s | F31: 0.30020000000000002 | G31: =(100%-F31)/F31 -> 2.3311125916055961
A32: A3s | B32: 0.30780000000000002 | C32: =(100%-B32)/B32 -> 2.2488628979857048 | E32: K3s | F32: 0.29670000000000002 | G32: =(100%-F32)/F32 -> 2.3704078193461409 | Y32: 43s | Z32: 0.28989999999999999 | AA32: =(100%-Z32)/Z32 -> 2.4494653328734044
A33: A2s | B33: 0.30370000000000003 | C33: =(100%-B33)/B33 -> 2.2927230819888043 | E33: K2s | F33: 0.29270000000000002 | G33: =(100%-F33)/F33 -> 2.4164673727365904
B35: Equity | C35: Odds Needed | F35: Equity | G35: Odds Needed | J35: Equity | K35: Odds Needed | N35: Equity | O35: Odds Needed
A36: AK | B36: 0.48649999999999999 | C36: =(100%-B36)/B36 -> 1.0554984583761564 | E36: KQ | F36: 0.29470000000000002 | G36: =(100%-F36)/F36 -> 2.3932813030200202 | I36: QJ | J36: 0.2964 | K36: =(100%-J36)/J36 -> 2.3738191632928474 | M36: JT | N36: 0.30120000000000002 | O36: =(100%-N36)/N36 -> 2.3200531208499333
A37: AQ | B37: 0.35599999999999998 | C37: =(100%-B37)/B37 -> 1.808988764044944 | E37: KJ | F37: 0.30909999999999999 | G37: =(100%-F37)/F37 -> 2.2351989647363317 | I37: QT | J37: 0.28360000000000002 | K37: =(100%-J37)/J37 -> 2.5260930888575452
A38: AJ | B38: 0.29620000000000002 | C38: =(100%-B38)/B38 -> 2.3760972316002698 | E38: KT | F38: 0.29659999999999997 | G38: =(100%-F38)/F38 -> 2.3715441672285911
A41: Tight range(MP v EP 15-20): 6.64%- 77+, AQ+ AJs+ KQs
B43: Equity | C43: Odds Needed
A44: 99 | B44: 0.45329999999999998 | C44: =(100%-B44)/B44 -> 1.2060445621001543
A45: 88 | B45: 0.4073 | C45: =(100%-B45)/B45 -> 1.4551927326295115
A46: 77 | B46: 0.36009999999999998 | C46: =(100%-B46)/B46 -> 1.7770063871146906
A47: 66 | B47: 0.34739999999999999 | C47: =(100%-B47)/B47 -> 1.8785261945883711
A48: 55 | B48: 0.34649999999999997 | C48: =(100%-B48)/B48 -> 1.8860028860028861
A49: 44 | B49: 0.34229999999999999 | C49: =(100%-B49)/B49 -> 1.9214139643587496
A50: 33 | B50: 0.3375 | C50: =(100%-B50)/B50 -> 1.9629629629629628
A51: 22 | B51: 0.33210000000000001 | C51: =(100%-B51)/B51 -> 2.011141222523336
B54: Equity | C54: Odds Needed | F54: Equity | G54: Odds Needed | J54: Equity | K54: Odds Needed | N54: Equity | O54: Odds Needed | R54: Equity | S54: Odds Needed | V54: Equity | W54: Odds Needed | Z54: Equity | AA54: Odds Needed
A55: AQs | B55: 0.43269999999999997 | C55: =(100%-B55)/B55 -> 1.3110700254217704 | E55: KQs | F55: 0.36909999999999998 | G55: =(100%-F55)/F55 -> 1.70929287455974 | I55: QJs | J55: 0.35630000000000001 | K55: =(100%-J55)/J55 -> 1.8066236317709794 | M55: JTs | N55: 0.36220000000000002 | O55: =(100%-N55)/N55 -> 1.7609055770292652 | Q55: T9s | R55: 0.34399999999999997 | S55: =(100%-R55)/R55 -> 1.9069767441860468 | U55: 98s | V55: 0.32300000000000001 | W55: =(100%-V55)/V55 -> 2.0959752321981426 | Y55: 65s | Z55: 0.30020000000000002 | AA55: =(100%-Z55)/Z55 -> 2.3311125916055961
A56: AJs | B56: 0.37840000000000001 | C56: =(100%-B56)/B56 -> 1.6427061310782238 | E56: KJs | F56: 0.36370000000000002 | G56: =(100%-F56)/F56 -> 1.7495188342040142 | I56: QTs | J56: 0.3518 | K56: =(100%-J56)/J56 -> 1.8425241614553725 | M56: J9s | N56: 0.33979999999999999 | O56: =(100%-N56)/N56 -> 1.9429075927015893 | Q56: T8s | R56: 0.32540000000000002 | S56: =(100%-R56)/R56 -> 2.0731407498463428 | U56: 97s | V56: 0.30649999999999999 | W56: =(100%-V56)/V56 -> 2.2626427406199023 | Y56: 64s | Z56: 0.2878 | AA56: =(100%-Z56)/Z56 -> 2.4746351633078523
A57: ATs | B57: 0.36070000000000002 | C57: =(100%-B57)/B57 -> 1.7723870252287217 | E57: KTs | F57: 0.35870000000000002 | G57: =(100%-F57)/F57 -> 1.7878449958182323 | I57: Q9s | J57: 0.3276 | K57: =(100%-J57)/J57 -> 2.0525030525030523 | M57: J8s | N57: 0.32140000000000002 | O57: =(100%-N57)/N57 -> 2.1113876789047912 | Q57: T7s | R57: 0.30609999999999998 | S57: =(100%-R57)/R57 -> 2.2669062397909179 | U57: 96s | V57: 0.29870000000000002 | W57: =(100%-V57)/V57 -> 2.3478406427854033 | Y57: 54s | Z57: 0.30109999999999998 | AA57: =(100%-Z57)/Z57 -> 2.3211557622052479
A58: A9s | B58: 0.34079999999999999 | C58: =(100%-B58)/B58 -> 1.9342723004694837 | E58: K9s | F58: 0.33529999999999999 | G58: =(100%-F58)/F58 -> 1.9824038174768865 | I58: Q8s | J58: 0.30980000000000002 | K58: =(100%-J58)/J58 -> 2.2278889606197545 | M58: J7s | N58: 0.3019 | O58: =(100%-N58)/N58 -> 2.3123550844650547 | Q58: T6s | R58: 0.29770000000000002 | S58: =(100%-R58)/R58 -> 2.3590863285186425 | U58: 95s | V58: 0.28820000000000001 | W58: =(100%-V58)/V58 -> 2.4698126301179735 | Y58: 53s | Z58: 0.28789999999999999 | AA58: =(100%-Z58)/Z58 -> 2.4734282737061477
A59: A8s | B59: 0.33169999999999999 | C59: =(100%-B59)/B59 -> 2.0147723846849561 | E59: K8s | F59: 0.31790000000000002 | G59: =(100%-F59)/F59 -> 2.1456432840515882 | I59: Q7s | J59: 0.29020000000000001 | K59: =(100%-J59)/J59 -> 2.4458993797381114 | M59: J6s | N59: 0.29380000000000001 | O59: =(100%-N59)/N59 -> 2.4036759700476513 | Q59: T5s | R59: 0.28710000000000002 | S59: =(100%-R59)/R59 -> 2.4831069313827934 | U59: 87s | V59: 0.307 | W59: =(100%-V59)/V59 -> 2.2573289902280131 | Y59: 43s | Z59: 0.2843 | AA59: =(100%-Z59)/Z59 -> 2.5174111853675694
A60: A7s | B60: 0.3216 | C60: =(100%-B60)/B60 -> 2.1094527363184081 | E60: K7s | F60: 0.31019999999999998 | G60: =(100%-F60)/F60 -> 2.2237266279819474 | I60: Q6s | J60: 0.29430000000000001 | K60: =(100%-J60)/J60 -> 2.3978933061501868 | M60: J5s | N60: 0.29559999999999997 | O60: =(100%-N60)/N60 -> 2.3829499323410017 | Q60: T4s | R60: 0.28670000000000001 | S60: =(100%-R60)/R60 -> 2.487966515521451 | U60: 86s | V60: 0.29980000000000001 | W60: =(100%-V60)/V60 -> 2.3355570380253501
A61: A6s | B61: 0.31950000000000001 | C61: =(100%-B61)/B61 -> 2.1298904538341157 | E61: K6s | F61: 0.31640000000000001 | G61: =(100%-F61)/F61 -> 2.1605562579013906 | I61: Q5s | J61: 0.29339999999999999 | K61: =(100%-J61)/J61 -> 2.4083162917518748 | M61: J4s | N61: 0.2923 | O61: =(100%-N61)/N61 -> 2.4211426616489908 | U61: 85s | V61: 0.28949999999999998 | W61: =(100%-V61)/V61 -> 2.4542314335060453
A62: A5s | B62: 0.33300000000000002 | C62: =(100%-B62)/B62 -> 2.0030030030030028 | E62: K5s | F62: 0.31080000000000002 | G62: =(100%-F62)/F62 -> 2.2175032175032174 | I62: Q4s | J62: 0.28989999999999999 | K62: =(100%-J62)/J62 -> 2.4494653328734044 | M62: J3s | N62: 0.2888 | O62: =(100%-N62)/N62 -> 2.4626038781163437 | U62: 76s | V62: 0.30020000000000002 | W62: =(100%-V62)/V62 -> 2.3311125916055961
A63: A4s | B63: 0.3296 | C63: =(100%-B63)/B63 -> 2.0339805825242716 | E63: K4s | F63: 0.30730000000000002 | G63: =(100%-F63)/F63 -> 2.2541490400260331 | I63: Q3s | J63: 0.2863 | K63: =(100%-J63)/J63 -> 2.4928396786587497 | M63: J2s | N63: 0.28510000000000002 | O63: =(100%-N63)/N63 -> 2.5075412136092599 | U63: 75s | V63: 0.29049999999999998 | W63: =(100%-V63)/V63 -> 2.4423407917383821
A64: A3s | B64: 0.3261 | C64: =(100%-B64)/B64 -> 2.0665440049064703 | E64: K3s | F64: 0.30370000000000003 | G64: =(100%-F64)/F64 -> 2.2927230819888043
A65: A2s | B65: 0.3225 | C65: =(100%-B65)/B65 -> 2.1007751937984493 | E65: K2s | F65: 0.30 | G65: =(100%-F65)/F65 -> 2.3333333333333335
B67: Equity | C67: Odds Needed | F67: Equity | G67: Odds Needed | J67: Equity | K67: Odds Needed | N67: Equity | O67: Odds Needed | R67: Equity | S67: Odds Needed | V67: Equity | W67: Odds Needed
A68: AK | B68: 0.49869999999999998 | C68: =(100%-B68)/B68 -> 1.0052135552436337 | E68: KQ | F68: 0.3325 | G68: =(100%-F68)/F68 -> 2.007518796992481 | I68: QJ | J68: 0.32090000000000002 | K68: =(100%-J68)/J68 -> 2.1162355874104084 | M68: JT | N68: 0.32819999999999999 | O68: =(100%-N68)/N68 -> 2.0469226081657523 | Q68: T9 | R68: 0.3095 | S68: =(100%-R68)/R68 -> 2.2310177705977385 | U68: 98 | V68: 0.28720000000000001 | W68: =(100%-V68)/V68 -> 2.4818941504178271
A69: AQ | B69: 0.4025 | C69: =(100%-B69)/B69 -> 1.4844720496894408 | E69: KJ | F69: 0.32829999999999998 | G69: =(100%-F69)/F69 -> 2.045994517209869 | I69: QT | J69: 0.31590000000000001 | K69: =(100%-J69)/J69 -> 2.1655587211142762 | M69: J9 | N69: 0.30430000000000001 | O69: =(100%-N69)/N69 -> 2.2862306933946761 | Q69: T8 | R69: 0.28970000000000001 | S69: =(100%-R69)/R69 -> 2.4518467380048321
A70: AJ | B70: 0.3417 | C70: =(100%-B70)/B70 -> 1.9265437518290898 | E70: KT | F70: 0.32340000000000002 | G70: =(100%-F70)/F70 -> 2.0921459492888062 | I70: Q9 | J70: 0.29070000000000001 | K70: =(100%-J70)/J70 -> 2.4399724802201583 | M70: J8 | N70: 0.2848 | O70: =(100%-N70)/N70 -> 2.51123595505618
A71: AT | B71: 0.32469999999999999 | C71: =(100%-B71)/B71 -> 2.0797659377887281 | E71: K9 | F71: 0.2984 | G71: =(100%-F71)/F71 -> 2.3512064343163539
A72: A9 | B72: 0.30330000000000001 | C72: =(100%-B72)/B72 -> 2.2970656116056709
A73: A8 | B73: 0.29370000000000002 | C73: =(100%-B73)/B73 -> 2.4048348655090224
A74: A7 | B74: 0.28310000000000002 | C74: =(100%-B74)/B74 -> 2.5323207347227128
A75: A6 | B75: 0.28110000000000002 | C75: =(100%-B75)/B75 -> 2.557452863749555
A76: A5 | B76: 0.29580000000000001 | C76: =(100%-B76)/B76 -> 2.3806626098715347
A77: A4 | B77: 0.29210000000000003 | C77: =(100%-B77)/B77 -> 2.4234851078397806
A78: A3 | B78: 0.28820000000000001 | C78: =(100%-B78)/B78 -> 2.4698126301179735
A79: A2 | B79: 0.28420000000000001 | C79: =(100%-B79)/B79 -> 2.5186488388458832
A82: Tight Medium (MP v MP 15-20 BBs) (: 8.9% - 66+, ATs+, AJo+, KJs+, QJs)
B84: Equity | C84: Odds Needed
A85: 99 | B85: 0.49070000000000003 | C85: =(100%-B85)/B85 -> 1.037905033625433
A86: 88 | B86: 0.45610000000000001 | C86: =(100%-B86)/B86 -> 1.1925016443762333
A87: 77 | B87: 0.42 | C87: =(100%-B87)/B87 -> 1.3809523809523812
A88: 66 | B88: 0.3861 | C88: =(100%-B88)/B88 -> 1.59000259000259
A89: 55 | B89: 0.37369999999999998 | C89: =(100%-B89)/B89 -> 1.6759432700026762
A90: 44 | B90: 0.36940000000000001 | C90: =(100%-B90)/B90 -> 1.7070925825663239
A91: 33 | B91: 0.36449999999999999 | C91: =(100%-B91)/B91 -> 1.7434842249657063
A92: 22 | B92: 0.35899999999999999 | C92: =(100%-B92)/B92 -> 1.785515320334262
B95: Equity | C95: Odds Needed | F95: Equity | G95: Odds Needed | J95: Equity | K95: Odds Needed | N95: Equity | O95: Odds Needed | R95: Equity | S95: Odds Needed | V95: Equity | W95: Odds Needed | Z95: Equity | AA95: Odds Needed | AD95: Equity | AE95: Odds Needed
A96: AQs | B96: 0.49120000000000003 | C96: =(100%-B96)/B96 -> 1.0358306188925079 | E96: KQs | F96: 0.40610000000000002 | G96: =(100%-F96)/F96 -> 1.4624476729869489 | I96: QJs | J96: 0.36609999999999998 | K96: =(100%-J96)/J96 -> 1.7314941272876265 | M96: JTs | N96: 0.36349999999999999 | O96: =(100%-N96)/N96 -> 1.7510316368638241 | Q96: T9s | R96: 0.35930000000000001 | S96: =(100%-R96)/R96 -> 1.7831895352073477 | U96: 98s | V96: 0.34699999999999998 | W96: =(100%-V96)/V96 -> 1.8818443804034584 | Y96: 87s | Z96: 0.33529999999999999 | AA96: =(100%-Z96)/Z96 -> 1.9824038174768865 | AC96: 65s | AD96: 0.317 | AE96: =(100%-AD96)/AD96 -> 2.1545741324921135
A97: AJs | B97: 0.42559999999999998 | C97: =(100%-B97)/B97 -> 1.3496240601503762 | E97: KJs | F97: 0.38169999999999998 | G97: =(100%-F97)/F97 -> 1.6198585276395077 | I97: QTs | J97: 0.36620000000000003 | K97: =(100%-J97)/J97 -> 1.7307482250136534 | M97: J9s | N97: 0.34599999999999997 | O97: =(100%-N97)/N97 -> 1.8901734104046244 | Q97: T8s | R97: 0.34350000000000003 | S97: =(100%-R97)/R97 -> 1.9112081513828236 | U97: 97s | V97: 0.3322 | W97: =(100%-V97)/V97 -> 2.0102347983142685 | Y97: 86s | Z97: 0.32 | AA97: =(100%-Z97)/Z97 -> 2.1249999999999996 | AC97: 64s | AD97: 0.30449999999999999 | AE97: =(100%-AD97)/AD97 -> 2.284072249589491
A98: ATs | B98: 0.38619999999999999 | C98: =(100%-B98)/B98 -> 1.5893319523562921 | E98: KTs | F98: 0.37709999999999999 | G98: =(100%-F98)/F98 -> 1.6518164942985947 | I98: Q9s | J98: 0.34860000000000002 | K98: =(100%-J98)/J98 -> 1.8686173264486516 | M98: J8s | N98: 0.33069999999999999 | O98: =(100%-N98)/N98 -> 2.0238887208950711 | Q98: T7s | R98: 0.32650000000000001 | S98: =(100%-R98)/R98 -> 2.0627871362940273 | U98: 96s | V98: 0.31640000000000001 | W98: =(100%-V98)/V98 -> 2.1605562579013906 | Y98: 85s | Z98: 0.3095 | AA98: =(100%-Z98)/Z98 -> 2.2310177705977385 | AC98: 63s | AD98: 0.29110000000000003 | AE98: =(100%-AD98)/AD98 -> 2.435245620061834
A99: A9s | B99: 0.36330000000000001 | C99: =(100%-B99)/B99 -> 1.7525461051472613 | E99: K9s | F99: 0.35930000000000001 | G99: =(100%-F99)/F99 -> 1.7831895352073477 | I99: Q8s | J99: 0.33339999999999997 | K99: =(100%-J99)/J99 -> 1.9994001199760052 | M99: J7s | N99: 0.31340000000000001 | O99: =(100%-N99)/N99 -> 2.1908104658583278 | Q99: T6s | R99: 0.31 | S99: =(100%-R99)/R99 -> 2.225806451612903 | U99: 95s | V99: 0.30590000000000001 | W99: =(100%-V99)/V99 -> 2.2690421706440009 | Y99: 84s | Z99: 0.29649999999999999 | AA99: =(100%-Z99)/Z99 -> 2.3726812816188874
A100: A8s | B100: 0.35659999999999997 | C100: =(100%-B100)/B100 -> 1.8042624789680315 | E100: K8s | F100: 0.34429999999999999 | G100: =(100%-F100)/F100 -> 1.904443799012489 | I100: Q7s | J100: 0.31669999999999998 | K100: =(100%-J100)/J100 -> 2.1575623618566468 | M100: J6s | N100: 0.29680000000000001 | O100: =(100%-N100)/N100 -> 2.3692722371967654 | Q100: T5s | R100: 0.29970000000000002 | S100: =(100%-R100)/R100 -> 2.3366700033366694 | U100: 94s | V100: 0.2928 | W100: =(100%-V100)/V100 -> 2.4153005464480874 | AC100: 54s | AD100: 0.31480000000000002 | AE100: =(100%-AD100)/AD100 -> 2.1766200762388817
A101: A7s | B101: 0.34889999999999999 | C101: =(100%-B101)/B101 -> 1.8661507595299514 | E101: K7s | F101: 0.33929999999999999 | G101: =(100%-F101)/F101 -> 1.9472443265546717 | I101: Q6s | J101: 0.31230000000000002 | K101: =(100%-J101)/J101 -> 2.202049311559398 | M101: J5s | N101: 0.29899999999999999 | O101: =(100%-N101)/N101 -> 2.344481605351171 | Q101: T4s | R101: 0.29930000000000001 | S101: =(100%-R101)/R101 -> 2.341129301703976 | U101: 93s | V101: 0.29239999999999999 | W101: =(100%-V101)/V101 -> 2.4199726402188784 | Y101: 76s | Z101: 0.32240000000000002 | AA101: =(100%-Z101)/Z101 -> 2.1017369727047144 | AC101: 53s | AD101: 0.30209999999999998 | AE101: =(100%-AD101)/AD101 -> 2.3101621979476996
A102: A6s | B102: 0.33900000000000002 | C102: =(100%-B102)/B102 -> 1.9498525073746311 | E102: K6s | F102: 0.3327 | G102: =(100%-F102)/F102 -> 2.0057108506161709 | I102: Q5s | J102: 0.312 | K102: =(100%-J102)/J102 -> 2.2051282051282048 | M102: J4s | N102: 0.29570000000000002 | O102: =(100%-N102)/N102 -> 2.3818058843422385 | Q102: T3s | R102: 0.29580000000000001 | S102: =(100%-R102)/R102 -> 2.3806626098715347 | U102: 92s | V102: 0.2888 | W102: =(100%-V102)/V102 -> 2.4626038781163437 | Y102: 75s | Z102: 0.31259999999999999 | AA102: =(100%-Z102)/Z102 -> 2.1989763275751759 | AC102: 52s | AD102: 0.28860000000000002 | AE102: =(100%-AD102)/AD102 -> 2.4650034650034649
A103: A5s | B103: 0.35139999999999999 | C103: =(100%-B103)/B103 -> 1.8457598178713719 | E103: K5s | F103: 0.33169999999999999 | G103: =(100%-F103)/F103 -> 2.0147723846849561 | I103: Q4s | J103: 0.30869999999999997 | K103: =(100%-J103)/J103 -> 2.2393909944930357 | M103: J3s | N103: 0.29210000000000003 | O103: =(100%-N103)/N103 -> 2.4234851078397806 | Q103: T2s | R103: 0.29220000000000002 | S103: =(100%-R103)/R103 -> 2.4223134839151266 | Y103: 74s | Z103: 0.29970000000000002 | AA103: =(100%-Z103)/Z103 -> 2.3366700033366694
A104: A4s | B104: 0.3483 | C104: =(100%-B104)/B104 -> 1.8710881424059718 | E104: K4s | F104: 0.32850000000000001 | G104: =(100%-F104)/F104 -> 2.0441400304414001 | I104: Q3s | J104: 0.30509999999999998 | K104: =(100%-J104)/J104 -> 2.2776138970829241 | M104: J2s | N104: 0.28839999999999999 | O104: =(100%-N104)/N104 -> 2.4674063800277395 | Y104: 73s | Z104: 0.28620000000000001 | AA104: =(100%-Z104)/Z104 -> 2.4940600978336827 | AC104: 43s | AD104: 0.29870000000000002 | AE104: =(100%-AD104)/AD104 -> 2.3478406427854033
A105: A3s | B105: 0.34489999999999998 | C105: =(100%-B105)/B105 -> 1.8993911278631488 | E105: K3s | F105: 0.3251 | G105: =(100%-F105)/F105 -> 2.0759766225776688 | I105: Q2s | J105: 0.30149999999999999 | K105: =(100%-J105)/J105 -> 2.3167495854063018 | AC105: 42s | AD105: 0.28539999999999999 | AE105: =(100%-AD105)/AD105 -> 2.5038542396636303
A106: A2s | B106: 0.34129999999999999 | C106: =(100%-B106)/B106 -> 1.929973630237328 | E106: K2s | F106: 0.32150000000000001 | G106: =(100%-F106)/F106 -> 2.1104199066874028
B109: Equity | C109: Odds Needed | F109: Equity | G109: Odds Needed | J109: Equity | K109: Odds Needed | N109: Equity | O109: Odds Needed | R109: Equity | S109: Odds Needed | V109: Equity | W109: Odds Needed | Z109: Equity | AA109: Odds Needed
A110: AQ | B110: 0.46439999999999998 | C110: =(100%-B110)/B110 -> 1.1533161068044791 | E110: KQ | F110: 0.37269999999999998 | G110: =(100%-F110)/F110 -> 1.6831231553528308 | I110: QJ | J110: 0.33 | K110: =(100%-J110)/J110 -> 2.0303030303030298 | M110: JT | N110: 0.32900000000000001 | O110: =(100%-N110)/N110 -> 2.0395136778115504 | Q110: T9 | R110: 0.32540000000000002 | S110: =(100%-R110)/R110 -> 2.0731407498463428 | U110: 98 | V110: 0.3125 | W110: =(100%-V110)/V110 -> 2.2000000000000002 | Y110: 87 | Z110: 0.3004 | AA110: =(100%-Z110)/Z110 -> 2.3288948069241013
A111: AJ | B111: 0.39450000000000002 | C111: =(100%-B111)/B111 -> 1.5348542458808616 | E111: KJ | F111: 0.34649999999999997 | G111: =(100%-F111)/F111 -> 1.8860028860028861 | I111: QT | J111: 0.33150000000000002 | K111: =(100%-J111)/J111 -> 2.0165912518853695 | M111: J9 | N111: 0.3105 | O111: =(100%-N111)/N111 -> 2.2206119162640903 | Q111: T8 | R111: 0.30859999999999999 | S111: =(100%-R111)/R111 -> 2.2404406999351911 | U111: 97 | V111: 0.2969 | W111: =(100%-V111)/V111 -> 2.3681374200067364 | Y111: 76 | Z111: 0.2868 | AA111: =(100%-Z111)/Z111 -> 2.4867503486750349
A112: AT | B112: 0.35010000000000002 | C112: =(100%-B112)/B112 -> 1.8563267637817762 | E112: KT | F112: 0.3422 | G112: =(100%-F112)/F112 -> 1.922267679719462 | I112: Q9 | J112: 0.31280000000000002 | K112: =(100%-J112)/J112 -> 2.1969309462915603 | M112: J8 | N112: 0.29420000000000002 | O112: =(100%-N112)/N112 -> 2.3990482664853841 | Q112: T7 | R112: 0.29060000000000002 | S112: =(100%-R112)/R112 -> 2.4411562284927735
A113: A9 | B113: 0.32669999999999999 | C113: =(100%-B113)/B113 -> 2.0609121518212428 | E113: K9 | F113: 0.32350000000000001 | G113: =(100%-F113)/F113 -> 2.0911901081916535 | I113: Q8 | J113: 0.29670000000000002 | K113: =(100%-J113)/J113 -> 2.3704078193461409
A114: A8 | B114: 0.31969999999999998 | C114: =(100%-B114)/B114 -> 2.1279324366593682 | E114: K8 | F114: 0.30740000000000001 | G114: =(100%-F114)/F114 -> 2.2530904359141184
A115: A7 | B115: 0.3115 | C115: =(100%-B115)/B115 -> 2.2102728731942216 | E115: K7 | F115: 0.30220000000000002 | G115: =(100%-F115)/F115 -> 2.3090668431502315
A116: A6 | B116: 0.30109999999999998 | C116: =(100%-B116)/B116 -> 2.3211557622052479 | E116: K6 | F116: 0.29530000000000001 | G116: =(100%-F116)/F116 -> 2.3863867253640363
A117: A5 | B117: 0.31459999999999999 | C117: =(100%-B117)/B117 -> 2.1786395422759059 | E117: K5 | F117: 0.2944 | G117: =(100%-F117)/F117 -> 2.3967391304347827
A118: A4 | B118: 0.31130000000000002 | C118: =(100%-B118)/B118 -> 2.2123353678123996 | E118: K4 | F118: 0.29099999999999998 | G118: =(100%-F118)/F118 -> 2.4364261168384882
A119: A3 | B119: 0.30759999999999998 | C119: =(100%-B119)/B119 -> 2.2509752925877766 | E119: K3 | F119: 0.28720000000000001 | G119: =(100%-F119)/F119 -> 2.4818941504178271
A120: A2 | B120: 0.30359999999999998 | C120: =(100%-B120)/B120 -> 2.293807641633729 | E120: K2 | F120: 0.2833 | G120: =(100%-F120)/F120 -> 2.5298270384751147
A124: Medium Range (HJ vs MP2 15-20 BBs) : 11.6%- 44+ ATs+, AJo+, KTs+, KQo, QTs+, JTs
B126: Equity | C126: Odds Needed
A127: 88 | B127: 0.49559999999999998 | C127: =(100%-B127)/B127 -> 1.0177562550443906
A128: 77 | B128: 0.46760000000000002 | C128: =(100%-B128)/B128 -> 1.1385799828913601
A129: 66 | B129: 0.44119999999999998 | C129: =(100%-B129)/B129 -> 1.2665457842248413
A130: 55 | B130: 0.41410000000000002 | C130: =(100%-B130)/B130 -> 1.4148756339048538
A131: 44 | B131: 0.38450000000000001 | C131: =(100%-B131)/B131 -> 1.6007802340702209
A132: 33 | B132: 0.3715 | C132: =(100%-B132)/B132 -> 1.6917900403768509
A133: 22 | B133: 0.36630000000000001 | C133: =(100%-B133)/B133 -> 1.7300027300027296
B136: Equity | C136: Odds Needed | F136: Equity | G136: Odds Needed | J136: Equity | K136: Odds Needed | N136: Equity | O136: Odds Needed | R136: Equity | S136: Odds Needed | V136: Equity | W136: Odds Needed | Z136: Equity | AA136: Odds Needed | AD136: Equity | AE136: Odds Needed
A137: AJs | B137: 0.46710000000000002 | C137: =(100%-B137)/B137 -> 1.140869192892314 | E137: KQs | F137: 0.44109999999999999 | G137: =(100%-F137)/F137 -> 1.2670596236681024 | I137: QJs | J137: 0.39150000000000001 | K137: =(100%-J137)/J137 -> 1.554278416347382 | M137: JTs | N137: 0.38030000000000003 | O137: =(100%-N137)/N137 -> 1.6295030239284771 | Q137: T9s | R137: 0.37269999999999998 | S137: =(100%-R137)/R137 -> 1.6831231553528308 | U137: 98s | V137: 0.36620000000000003 | W137: =(100%-V137)/V137 -> 1.7307482250136534 | Y137: 87s | Z137: 0.35670000000000002 | AA137: =(100%-Z137)/Z137 -> 1.803476310625175 | AC137: 65s | AD137: 0.33779999999999999 | AE137: =(100%-AD137)/AD137 -> 1.9603315571343991
A138: ATs | B138: 0.43830000000000002 | C138: =(100%-B138)/B138 -> 1.2815423226100844 | E138: KJs | F138: 0.40849999999999997 | G138: =(100%-F138)/F138 -> 1.447980416156671 | I138: QTs | J138: 0.3841 | K138: =(100%-J138)/J138 -> 1.6034886748242645 | M138: J9s | N138: 0.36399999999999999 | O138: =(100%-N138)/N138 -> 1.7472527472527473 | Q138: T8s | R138: 0.35830000000000001 | S138: =(100%-R138)/R138 -> 1.7909572983533351 | U138: 97s | V138: 0.35299999999999998 | W138: =(100%-V138)/V138 -> 1.8328611898016998 | Y138: 86s | Z138: 0.34379999999999999 | AA138: =(100%-Z138)/Z138 -> 1.9086678301337987 | AC138: 64s | AD138: 0.31969999999999998 | AE138: =(100%-AD138)/AD138 -> 2.1279324366593682
A139: A9s | B139: 0.4128 | C139: =(100%-B139)/B139 -> 1.4224806201550386 | E139: KTs | F139: 0.40699999999999997 | G139: =(100%-F139)/F139 -> 1.4570024570024571 | I139: Q9s | J139: 0.3649 | K139: =(100%-J139)/J139 -> 1.740476842970677 | M139: J8s | N139: 0.35010000000000002 | O139: =(100%-N139)/N139 -> 1.8563267637817762 | Q139: T7s | R139: 0.34320000000000001 | S139: =(100%-R139)/R139 -> 1.9137529137529139 | U139: 96s | V139: 0.33879999999999999 | W139: =(100%-V139)/V139 -> 1.9515938606847698 | Y139: 85s | Z139: 0.32790000000000002 | AA139: =(100%-Z139)/Z139 -> 2.0497102775236349 | AC139: 63s | AD139: 0.30659999999999998 | AE139: =(100%-AD139)/AD139 -> 2.2615786040443577
A140: A8s | B140: 0.40699999999999997 | C140: =(100%-B140)/B140 -> 1.4570024570024571 | E140: K9s | F140: 0.37819999999999998 | G140: =(100%-F140)/F140 -> 1.6441036488630356 | I140: Q8s | J140: 0.35049999999999998 | K140: =(100%-J140)/J140 -> 1.8530670470756063 | M140: J7s | N140: 0.33489999999999998 | O140: =(100%-N140)/N140 -> 1.9859659599880564 | Q140: T6s | R140: 0.32819999999999999 | S140: =(100%-R140)/R140 -> 2.0469226081657523 | U140: 95s | V140: 0.32269999999999999 | W140: =(100%-V140)/V140 -> 2.0988534242330341 | Y140: 84s | Z140: 0.30930000000000002 | AA140: =(100%-Z140)/Z140 -> 2.2331070158422244 | AC140: 62s | AD140: 0.29330000000000001 | AE140: =(100%-AD140)/AD140 -> 2.4094783498124785
A141: A7s | B141: 0.4007 | C141: =(100%-B141)/B141 -> 1.4956326428749687 | E141: K8s | F141: 0.36459999999999998 | G141: =(100%-F141)/F141 -> 1.7427317608337904 | I141: Q7s | J141: 0.33629999999999999 | K141: =(100%-J141)/J141 -> 1.9735355337496283 | M141: J6s | N141: 0.32 | O141: =(100%-N141)/N141 -> 2.1249999999999996 | Q141: T5s | R141: 0.312 | S141: =(100%-R141)/R141 -> 2.2051282051282048 | U141: 94s | V141: 0.30409999999999998 | W141: =(100%-V141)/V141 -> 2.2883919763235778 | Y141: 83s | Z141: 0.29649999999999999 | AA141: =(100%-Z141)/Z141 -> 2.3726812816188874 | AC141: 54s | AD141: 0.3266 | AE141: =(100%-AD141)/AD141 -> 2.061849357011635
A142: A6s | B142: 0.3926 | C142: =(100%-B142)/B142 -> 1.5471217524197656 | E142: K7s | F142: 0.36009999999999998 | G142: =(100%-F142)/F142 -> 1.7770063871146906 | I142: Q6s | J142: 0.33300000000000002 | K142: =(100%-J142)/J142 -> 2.0030030030030028 | M142: J5s | N142: 0.316 | O142: =(100%-N142)/N142 -> 2.1645569620253164 | Q142: T4s | R142: 0.30599999999999999 | S142: =(100%-R142)/R142 -> 2.2679738562091503 | U142: 93s | V142: 0.30420000000000003 | W142: =(100%-V142)/V142 -> 2.2873109796186717 | Y142: 82s | Z142: 0.29609999999999997 | AA142: =(100%-Z142)/Z142 -> 2.3772374197906112 | AC142: 53s | AD142: 0.31330000000000002 | AE142: =(100%-AD142)/AD142 -> 2.1918289179699966
A143: A5s | B143: 0.39789999999999998 | C143: =(100%-B143)/B143 -> 1.5131942699170649 | E143: K6s | F143: 0.3553 | G143: =(100%-F143)/F143 -> 1.8145229383619477 | I143: Q5s | J143: 0.32650000000000001 | K143: =(100%-J143)/J143 -> 2.0627871362940273 | M143: J4s | N143: 0.30730000000000002 | O143: =(100%-N143)/N143 -> 2.2541490400260331 | Q143: T3s | R143: 0.30320000000000003 | S143: =(100%-R143)/R143 -> 2.2981530343007912 | U143: 92s | V143: 0.30080000000000001 | W143: =(100%-V143)/V143 -> 2.3244680851063833 | Y143: 76s | Z143: 0.34770000000000001 | AA143: =(100%-Z143)/Z143 -> 1.8760425654299684 | AC143: 52s | AD143: 0.30 | AE143: =(100%-AD143)/AD143 -> 2.3333333333333335
A144: A4s | B144: 0.38919999999999999 | C144: =(100%-B144)/B144 -> 1.5693730729701954 | E144: K5s | F144: 0.34870000000000001 | G144: =(100%-F144)/F144 -> 1.8677946659019213 | I144: Q4s | J144: 0.31759999999999999 | K144: =(100%-J144)/J144 -> 2.1486146095717884 | M144: J3s | N144: 0.30430000000000001 | O144: =(100%-N144)/N144 -> 2.2862306933946761 | Q144: T2s | R144: 0.29970000000000002 | S144: =(100%-R144)/R144 -> 2.3366700033366694 | Y144: 75s | Z144: 0.3325 | AA144: =(100%-Z144)/Z144 -> 2.007518796992481 | AC144: 43s | AD144: 0.30370000000000003 | AE144: =(100%-AD144)/AD144 -> 2.2927230819888043
A145: A3s | B145: 0.38490000000000002 | C145: =(100%-B145)/B145 -> 1.5980774227071966 | E145: K4s | F145: 0.33989999999999998 | G145: =(100%-F145)/F145 -> 1.9420417769932334 | I145: Q3s | J145: 0.31440000000000001 | K145: =(100%-J145)/J145 -> 2.1806615776081424 | M145: J2s | N145: 0.30070000000000002 | O145: =(100%-N145)/N145 -> 2.3255736614566014 | Y145: 74s | Z145: 0.31409999999999999 | AA145: =(100%-Z145)/Z145 -> 2.1836994587710921 | AC145: 42s | AD145: 0.29070000000000001 | AE145: =(100%-AD145)/AD145 -> 2.4399724802201583
A146: A2s | B146: 0.38190000000000002 | C146: =(100%-B146)/B146 -> 1.6184865147944487 | E146: K3s | F146: 0.33629999999999999 | G146: =(100%-F146)/F146 -> 1.9735355337496283 | I146: Q2s | J146: 0.31079999999999997 | K146: =(100%-J146)/J146 -> 2.2175032175032179 | Y146: 73s | Z146: 0.30099999999999999 | AA146: =(100%-Z146)/Z146 -> 2.322259136212625 | AC146: 32s | AD146: 0.28510000000000002 | AE146: =(100%-AD146)/AD146 -> 2.5075412136092599
E147: K2s | F147: 0.33300000000000002 | G147: =(100%-F147)/F147 -> 2.0030030030030028 | Y147: 72s | Z147: 0.28770000000000001 | AA147: =(100%-Z147)/Z147 -> 2.4758428919012858
B149: Equity | C149: Odds Needed | F149: Equity | G149: Odds Needed | J149: Equity | K149: Odds Needed | N149: Equity | O149: Odds Needed | R149: Equity | S149: Odds Needed | V149: Equity | W149: Odds Needed | Z149: Equity | AA149: Odds Needed | AD149: Equity | AE149: Odds Needed
A150: AQ | B150: 0.4975 | C150: =(100%-B150)/B150 -> 1.0100502512562812 | E150: KQ | F150: 0.41120000000000001 | G150: =(100%-F150)/F150 -> 1.4319066147859922 | I150: QJ | J150: 0.35770000000000002 | K150: =(100%-J150)/J150 -> 1.795638803466592 | M150: JT | N150: 0.34560000000000002 | O150: =(100%-N150)/N150 -> 1.8935185185185184 | Q150: T9 | R150: 0.33910000000000001 | S150: =(100%-R150)/R150 -> 1.9489826010026541 | U150: 98 | V150: 0.33279999999999998 | W150: =(100%-V150)/V150 -> 2.0048076923076925 | Y150: 87 | Z150: 0.32300000000000001 | AA150: =(100%-Z150)/Z150 -> 2.0959752321981426 | AC150: 65 | AD150: 0.30320000000000003 | AE150: =(100%-AD150)/AD150 -> 2.2981530343007912
A151: AJ | B151: 0.43819999999999998 | C151: =(100%-B151)/B151 -> 1.2820629849383844 | E151: KJ | F151: 0.37540000000000001 | G151: =(100%-F151)/F151 -> 1.663825253063399 | I151: QT | J151: 0.34960000000000002 | K151: =(100%-J151)/J151 -> 1.860411899313501 | M151: J9 | N151: 0.3296 | O151: =(100%-N151)/N151 -> 2.0339805825242716 | Q151: T8 | R151: 0.32379999999999998 | S151: =(100%-R151)/R151 -> 2.0883261272390365 | U151: 97 | V151: 0.31890000000000002 | W151: =(100%-V151)/V151 -> 2.1357792411414236 | Y151: 86 | Z151: 0.30919999999999997 | AA151: =(100%-Z151)/Z151 -> 2.2341526520051751 | AC151: 64 | AD151: 0.28399999999999997 | AE151: =(100%-AD151)/AD151 -> 2.5211267605633805
A152: AT | B152: 0.40670000000000001 | C152: =(100%-B152)/B152 -> 1.4588148512417014 | E152: KT | F152: 0.36680000000000001 | G152: =(100%-F152)/F152 -> 1.7262813522355507 | I152: Q9 | J152: 0.33 | K152: =(100%-J152)/J152 -> 2.0303030303030298 | M152: J8 | N152: 0.31490000000000001 | O152: =(100%-N152)/N152 -> 2.1756113051762465 | Q152: T7 | R152: 0.30769999999999997 | S152: =(100%-R152)/R152 -> 2.2499187520311996 | U152: 96 | V152: 0.30380000000000001 | W152: =(100%-V152)/V152 -> 2.2916392363396967 | Y152: 85 | Z152: 0.2923 | AA152: =(100%-Z152)/Z152 -> 2.4211426616489908 | AC152: 54 | AD152: 0.29139999999999999 | AE152: =(100%-AD152)/AD152 -> 2.4317089910775569
A153: A9 | B153: 0.37930000000000003 | C153: =(100%-B153)/B153 -> 1.6364355391510677 | E153: K9 | F153: 0.34320000000000001 | G153: =(100%-F153)/F153 -> 1.9137529137529139 | I153: Q8 | J153: 0.31469999999999998 | K153: =(100%-J153)/J153 -> 2.1776294884016525 | M153: J7 | N153: 0.29870000000000002 | O153: =(100%-N153)/N153 -> 2.3478406427854033 | Q153: T6 | R153: 0.29170000000000001 | S153: =(100%-R153)/R153 -> 2.428179636612958 | U153: 95 | V153: 0.2868 | W153: =(100%-V153)/V153 -> 2.4867503486750349 | Y153: 76 | Z153: 0.3135 | AA153: =(100%-Z153)/Z153 -> 2.1897926634768741
A154: A8 | B154: 0.37309999999999999 | C154: =(100%-B154)/B154 -> 1.6802465826856072 | E154: K8 | F154: 0.32869999999999999 | G154: =(100%-F154)/F154 -> 2.0422878004259202 | I154: Q7 | J154: 0.29949999999999999 | K154: =(100%-J154)/J154 -> 2.33889816360601 | M154: J6 | N154: 0.2828 | O154: =(100%-N154)/N154 -> 2.5360678925035365 | Y154: 75 | Z154: 0.2974 | AA154: =(100%-Z154)/Z154 -> 2.3624747814391394
A155: A7 | B155: 0.36649999999999999 | C155: =(100%-B155)/B155 -> 1.7285129604365619 | E155: K7 | F155: 0.3246 | G155: =(100%-F155)/F155 -> 2.0807147258163896 | I155: Q6 | J155: 0.29609999999999997 | K155: =(100%-J155)/J155 -> 2.3772374197906112
A156: A6 | B156: 0.35780000000000001 | C156: =(100%-B156)/B156 -> 1.7948574622694242 | E156: K6 | F156: 0.31890000000000002 | G156: =(100%-F156)/F156 -> 2.1357792411414236 | I156: Q5 | J156: 0.28920000000000001 | K156: =(100%-J156)/J156 -> 2.4578146611341629
A157: A5 | B157: 0.36370000000000002 | C157: =(100%-B157)/B157 -> 1.7495188342040142 | E157: K5 | F157: 0.31190000000000001 | G157: =(100%-F157)/F157 -> 2.2061558191728117
A158: A4 | B158: 0.35439999999999999 | C158: =(100%-B158)/B158 -> 1.8216704288939052 | E158: K4 | F158: 0.3025 | G158: =(100%-F158)/F158 -> 2.3057851239669422
A159: A3 | B159: 0.34989999999999999 | C159: =(100%-B159)/B159 -> 1.857959416976279 | E159: K3 | F159: 0.29880000000000001 | G159: =(100%-F159)/F159 -> 2.3467202141900936
A160: A2 | B160: 0.34660000000000002 | C160: =(100%-B160)/B160 -> 1.8851702250432774 | E160: K2 | F160: 0.29520000000000002 | G160: =(100%-F160)/F160 -> 2.3875338753387534
A163: Loose Medium (CO v HJ) range: 14.9%- 22+, AT+, A8s+, K9s+, KQ+, QTs, J9s,T9s
B165: Equity | C165: Odds Needed
A166: 66 | B166: 0.47839999999999999 | C166: =(100%-B166)/B166 -> 1.0903010033444818
A167: 55 | B167: 0.45610000000000001 | C167: =(100%-B167)/B167 -> 1.1925016443762333
A168: 44 | B168: 0.43190000000000001 | C168: =(100%-B168)/B168 -> 1.31535077564251
A169: 33 | B169: 0.40760000000000002 | C169: =(100%-B169)/B169 -> 1.4533856722276741
A170: 22 | B170: 0.38340000000000002 | C170: =(100%-B170)/B170 -> 1.6082420448617631
B173: Equity | C173: Odds Needed | F173: Equity | G173: Odds Needed | J173: Equity | K173: Odds Needed | N173: Equity | O173: Odds Needed | R173: Equity | S173: Odds Needed | V173: Equity | W173: Odds Needed | Z173: Equity | AA173: Odds Needed | AD173: Equity | AE173: Odds Needed
A174: AJs | B174: Favorite | E174: KQs | F174: 0.4587 | G174: =(100%-F174)/F174 -> 1.1800741225201656 | I174: QJs | J174: 0.41820000000000002 | K174: =(100%-J174)/J174 -> 1.3912003825920611 | M174: JTs | N174: 0.40310000000000001 | O174: =(100%-N174)/N174 -> 1.4807740014884643 | Q174: T9s | R174: 0.38169999999999998 | S174: =(100%-R174)/R174 -> 1.6198585276395077 | U174: 98s | V174: 0.37540000000000001 | W174: =(100%-V174)/V174 -> 1.663825253063399 | Y174: 87s | Z174: 0.37180000000000002 | AA174: =(100%-Z174)/Z174 -> 1.6896180742334588 | AC174: 65s | AD174: 0.3575 | AE174: =(100%-AD174)/AD174 -> 1.7972027972027975
A175: ATs | B175: 0.46860000000000002 | C175: =(100%-B175)/B175 -> 1.1340162185232607 | E175: KJs | F175: 0.43369999999999997 | G175: =(100%-F175)/F175 -> 1.3057412958266084 | I175: QTs | J175: 0.40450000000000003 | K175: =(100%-J175)/J175 -> 1.4721878862793569 | M175: J9s | N175: 0.38550000000000001 | O175: =(100%-N175)/N175 -> 1.5940337224383918 | Q175: T8s | R175: 0.36859999999999998 | S175: =(100%-R175)/R175 -> 1.7129679869777537 | U175: 97s | V175: 0.3649 | W175: =(100%-V175)/V175 -> 1.740476842970677 | Y175: 86s | Z175: 0.3594 | AA175: =(100%-Z175)/Z175 -> 1.7824151363383418 | AC175: 64s | AD175: 0.34110000000000001 | AE175: =(100%-AD175)/AD175 -> 1.931691586045148
A176: A9s | B176: 0.43419999999999997 | C176: =(100%-B176)/B176 -> 1.3030861354214651 | E176: KTs | F176: 0.41970000000000002 | G176: =(100%-F176)/F176 -> 1.382654276864427 | I176: Q9s | J176: 0.38769999999999999 | K176: =(100%-J176)/J176 -> 1.5793139025019347 | M176: J8s | N176: 0.37080000000000002 | O176: =(100%-N176)/N176 -> 1.6968716289104637 | Q176: T7s | R176: 0.35630000000000001 | S176: =(100%-R176)/R176 -> 1.8066236317709794 | U176: 96s | V176: 0.35149999999999998 | W176: =(100%-V176)/V176 -> 1.8449502133712663 | Y176: 85s | Z176: 0.34439999999999998 | AA176: =(100%-Z176)/Z176 -> 1.9036004645760742 | AC176: 63s | AD176: 0.32379999999999998 | AE176: =(100%-AD176)/AD176 -> 2.0883261272390365
A177: A8s | B177: 0.42059999999999997 | C177: =(100%-B177)/B177 -> 1.3775558725630053 | E177: K9s | F177: 0.39939999999999998 | G177: =(100%-F177)/F177 -> 1.5037556334501754 | I177: Q8s | J177: 0.37369999999999998 | K177: =(100%-J177)/J177 -> 1.6759432700026762 | M177: J7s | N177: 0.35799999999999998 | O177: =(100%-N177)/N177 -> 1.793296089385475 | Q177: T6s | R177: 0.3425 | S177: =(100%-R177)/R177 -> 1.9197080291970801 | U177: 95s | V177: 0.33629999999999999 | W177: =(100%-V177)/V177 -> 1.9735355337496283 | Y177: 84s | Z177: 0.32719999999999999 | AA177: =(100%-Z177)/Z177 -> 2.0562347188264063 | AC177: 62s | AD177: 0.30599999999999999 | AE177: =(100%-AD177)/AD177 -> 2.2679738562091503
A178: A7s | B178: 0.41310000000000002 | C178: =(100%-B178)/B178 -> 1.4207213749697409 | E178: K8s | F178: 0.38150000000000001 | G178: =(100%-F178)/F178 -> 1.6212319790301444 | I178: Q7s | J178: 0.36209999999999998 | K178: =(100%-J178)/J178 -> 1.7616680475006905 | M178: J6s | N178: 0.34449999999999997 | O178: =(100%-N178)/N178 -> 1.9027576197387519 | Q178: T5s | R178: 0.32740000000000002 | S178: =(100%-R178)/R178 -> 2.0543677458766032 | U178: 94s | V178: 0.31919999999999998 | W178: =(100%-V178)/V178 -> 2.1328320802005014 | Y178: 83s | Z178: 0.30969999999999998 | AA178: =(100%-Z178)/Z178 -> 2.2289312237649339 | AC178: 54s | AD178: 0.34820000000000001 | AE178: =(100%-AD178)/AD178 -> 1.8719126938541066
A179: A6s | B179: 0.40600000000000003 | C179: =(100%-B179)/B179 -> 1.4630541871921181 | E179: K7s | F179: 0.38059999999999999 | G179: =(100%-F179)/F179 -> 1.627430373095113 | I179: Q6s | J179: 0.36020000000000002 | K179: =(100%-J179)/J179 -> 1.7762354247640197 | M179: J5s | N179: 0.34139999999999998 | O179: =(100%-N179)/N179 -> 1.929115407147042 | Q179: T4s | R179: 0.3226 | S179: =(100%-R179)/R179 -> 2.0998140111593306 | U179: 93s | V179: 0.31440000000000001 | W179: =(100%-V179)/V179 -> 2.1806615776081424 | Y179: 82s | Z179: 0.3049 | AA179: =(100%-Z179)/Z179 -> 2.2797638570022958 | AC179: 53s | AD179: 0.33119999999999999 | AE179: =(100%-AD179)/AD179 -> 2.0193236714975846
A180: A5s | B180: 0.4118 | C180: =(100%-B180)/B180 -> 1.4283632831471589 | E180: K6s | F180: 0.37630000000000002 | G180: =(100%-F180)/F180 -> 1.6574541589157583 | I180: Q5s | J180: 0.35449999999999998 | K180: =(100%-J180)/J180 -> 1.8208744710860367 | M180: J4s | N180: 0.3342 | O180: =(100%-N180)/N180 -> 1.9922202274087371 | Q180: T3s | R180: 0.31490000000000001 | S180: =(100%-R180)/R180 -> 2.1756113051762465 | U180: 92s | V180: 0.31440000000000001 | W180: =(100%-V180)/V180 -> 2.1806615776081424 | Y180: 76s | Z180: 0.36580000000000001 | AA180: =(100%-Z180)/Z180 -> 1.733734281027884 | AC180: 52s | AD180: 0.3135 | AE180: =(100%-AD180)/AD180 -> 2.1897926634768741
A181: A4s | B181: 0.40450000000000003 | C181: =(100%-B181)/B181 -> 1.4721878862793569 | E181: K5s | F181: 0.3705 | G181: =(100%-F181)/F181 -> 1.6990553306342779 | I181: Q4s | J181: 0.34720000000000001 | K181: =(100%-J181)/J181 -> 1.8801843317972351 | M181: J3s | N181: 0.32650000000000001 | O181: =(100%-N181)/N181 -> 2.0627871362940273 | Q181: T2s | R181: 0.30690000000000001 | S181: =(100%-R181)/R181 -> 2.2583903551645488 | Y181: 75s | Z181: 0.35139999999999999 | AA181: =(100%-Z181)/Z181 -> 1.8457598178713719 | AC181: 43s | AD181: 0.32300000000000001 | AE181: =(100%-AD181)/AD181 -> 2.0959752321981426
A182: A3s | B182: 0.39700000000000002 | C182: =(100%-B182)/B182 -> 1.5188916876574305 | E182: K4s | F182: 0.36330000000000001 | G182: =(100%-F182)/F182 -> 1.7525461051472613 | I182: Q3s | J182: 0.33960000000000001 | K182: =(100%-J182)/J182 -> 1.9446407538280328 | M182: J2s | N182: 0.31859999999999999 | O182: =(100%-N182)/N182 -> 2.1387319522912742 | Y182: 74s | Z182: 0.33439999999999998 | AA182: =(100%-Z182)/Z182 -> 1.9904306220095693 | AC182: 42s | AD182: 0.30549999999999999 | AE182: =(100%-AD182)/AD182 -> 2.2733224222585924
A183: A2s | B183: 0.38919999999999999 | C183: =(100%-B183)/B183 -> 1.5693730729701954 | E183: K3s | F183: 0.35570000000000002 | G183: =(100%-F183)/F183 -> 1.8113578858588697 | I183: Q2s | J183: 0.33169999999999999 | K183: =(100%-J183)/J183 -> 2.0147723846849561 | Y183: 73s | Z183: 0.31690000000000002 | AA183: =(100%-Z183)/Z183 -> 2.1555695803092458 | AC183: 32s | AD183: 0.29709999999999998 | AE183: =(100%-AD183)/AD183 -> 2.3658700774150123
E184: K2s | F184: 0.34799999999999998 | G184: =(100%-F184)/F184 -> 1.8735632183908049 | Y184: 72s | Z184: 0.29920000000000002 | AA184: =(100%-Z184)/Z184 -> 2.3422459893048124
B186: Equity | C186: Odds Needed | F186: Equity | G186: Odds Needed | J186: Equity | K186: Odds Needed | N186: Equity | O186: Odds Needed | R186: Equity | S186: Odds Needed | V186: Equity | W186: Odds Needed | Z186: Equity | AA186: Odds Needed | AD186: Equity | AE186: Odds Needed
A187: AJ | B187: 0.47789999999999999 | C187: =(100%-B187)/B187 -> 1.0924879681941828 | E187: KQ | F187: 0.4294 | G187: =(100%-F187)/F187 -> 1.3288309268747089 | I187: QJ | J187: 0.38640000000000002 | K187: =(100%-J187)/J187 -> 1.5879917184265007 | M187: JT | N187: 0.37080000000000002 | O187: =(100%-N187)/N187 -> 1.6968716289104637 | Q187: T9 | R187: 0.3478 | S187: =(100%-R187)/R187 -> 1.875215641173088 | U187: 98 | V187: 0.34210000000000002 | W187: =(100%-V187)/V187 -> 1.9231218941829871 | Y187: 87 | Z187: 0.33900000000000002 | AA187: =(100%-Z187)/Z187 -> 1.9498525073746311 | AC187: 65 | AD187: 0.3241 | AE187: =(100%-AD187)/AD187 -> 2.0854674483184201
A188: AT | B188: 0.43959999999999999 | C188: =(100%-B188)/B188 -> 1.2747952684258417 | E188: KJ | F188: 0.40239999999999998 | G188: =(100%-F188)/F188 -> 1.4850894632206761 | I188: QT | J188: 0.37180000000000002 | K188: =(100%-J188)/J188 -> 1.6896180742334588 | M188: J9 | N188: 0.35160000000000002 | O188: =(100%-N188)/N188 -> 1.8441410693970419 | Q188: T8 | R188: 0.33479999999999999 | S188: =(100%-R188)/R188 -> 1.9868578255675031 | U188: 97 | V188: 0.33100000000000002 | W188: =(100%-V188)/V188 -> 2.0211480362537766 | Y188: 86 | Z188: 0.32579999999999998 | AA188: =(100%-Z188)/Z188 -> 2.0693677102516883 | AC188: 64 | AD188: 0.30649999999999999 | AE188: =(100%-AD188)/AD188 -> 2.2626427406199023
A189: A9 | B189: 0.40189999999999998 | C189: =(100%-B189)/B189 -> 1.4881811395869622 | E189: KT | F189: 0.38740000000000002 | G189: =(100%-F189)/F189 -> 1.5813113061435209 | I189: Q9 | J189: 0.35420000000000001 | K189: =(100%-J189)/J189 -> 1.8232636928289099 | M189: J8 | N189: 0.33589999999999998 | O189: =(100%-N189)/N189 -> 1.9770765108663295 | Q189: T7 | R189: 0.32190000000000002 | S189: =(100%-R189)/R189 -> 2.1065548306927613 | U189: 96 | V189: 0.31680000000000003 | W189: =(100%-V189)/V189 -> 2.1565656565656566 | Y189: 85 | Z189: 0.30990000000000001 | AA189: =(100%-Z189)/Z189 -> 2.2268473701193932 | AC189: 63 | AD189: 0.28810000000000002 | AE189: =(100%-AD189)/AD189 -> 2.4710170079833387
A190: A8 | B190: 0.38690000000000002 | C190: =(100%-B190)/B190 -> 1.5846471956577926 | E190: K9 | F190: 0.36520000000000002 | G190: =(100%-F190)/F190 -> 1.7382256297918948 | I190: Q8 | J190: 0.33910000000000001 | K190: =(100%-J190)/J190 -> 1.9489826010026541 | M190: J7 | N190: 0.3201 | O190: =(100%-N190)/N190 -> 2.1240237425804436 | Q190: T6 | R190: 0.30709999999999998 | S190: =(100%-R190)/R190 -> 2.2562683165092805 | U190: 95 | V190: 0.307 | W190: =(100%-V190)/V190 -> 2.2573289902280131 | Y190: 84 | Z190: 0.29149999999999998 | AA190: =(100%-Z190)/Z190 -> 2.4305317324185252 | AC190: 54 | AD190: 0.31430000000000002 | AE190: =(100%-AD190)/AD190 -> 2.1816735602927135
A191: A7 | B191: 0.37940000000000002 | C191: =(100%-B191)/B191 -> 1.6357406431207169 | E191: K8 | F191: 0.34639999999999999 | G191: =(100%-F191)/F191 -> 1.8868360277136258 | I191: Q7 | J191: 0.32669999999999999 | K191: =(100%-J191)/J191 -> 2.0609121518212428 | M191: J6 | N191: 0.30869999999999997 | O191: =(100%-N191)/N191 -> 2.2393909944930357 | Q191: T5 | R191: 0.29099999999999998 | S191: =(100%-R191)/R191 -> 2.4364261168384882 | U191: 94 | V191: 0.28239999999999998 | W191: =(100%-V191)/V191 -> 2.5410764872521248 | Y191: 76 | Z191: 0.33279999999999998 | AA191: =(100%-Z191)/Z191 -> 2.0048076923076925 | AC191: 53 | AD191: 0.29620000000000002 | AE191: =(100%-AD191)/AD191 -> 2.3760972316002698
A192: A6 | B192: 0.37180000000000002 | C192: =(100%-B192)/B192 -> 1.6896180742334588 | E192: K7 | F192: 0.34570000000000001 | G192: =(100%-F192)/F192 -> 1.8926815157651142 | I192: Q6 | J192: 0.32479999999999998 | K192: =(100%-J192)/J192 -> 2.0788177339901481 | M192: J5 | N192: 0.30549999999999999 | O192: =(100%-N192)/N192 -> 2.2733224222585924 | Q192: T4 | R192: 0.28589999999999999 | S192: =(100%-R192)/R192 -> 2.497726477789437 | Y192: 75 | Z192: 0.31759999999999999 | AA192: =(100%-Z192)/Z192 -> 2.1486146095717884 | AC192: 43 | AD192: 0.28749999999999998 | AE192: =(100%-AD192)/AD192 -> 2.4782608695652177
A193: A5 | B193: 0.37809999999999999 | C193: =(100%-B193)/B193 -> 1.6448029621793177 | E193: K6 | F193: 0.34110000000000001 | G193: =(100%-F193)/F193 -> 1.931691586045148 | I193: Q5 | J193: 0.31890000000000002 | K193: =(100%-J193)/J193 -> 2.1357792411414236 | M193: J4 | N193: 0.29770000000000002 | O193: =(100%-N193)/N193 -> 2.3590863285186425 | Y193: 74 | Z193: 0.2994 | AA193: =(100%-Z193)/Z193 -> 2.3400133600534403
A194: A4 | B194: 0.37030000000000002 | C194: =(100%-B194)/B194 -> 1.7005130974885225 | E194: K5 | F194: 0.335 | G194: =(100%-F194)/F194 -> 1.9850746268656716 | I194: Q4 | J194: 0.311 | K194: =(100%-J194)/J194 -> 2.2154340836012865 | M194: J3 | N194: 0.28949999999999998 | O194: =(100%-N194)/N194 -> 2.4542314335060453
A195: A3 | B195: 0.36230000000000001 | C195: =(100%-B195)/B195 -> 1.7601435274634278 | E195: K4 | F195: 0.32729999999999998 | G195: =(100%-F195)/F195 -> 2.0553009471432939 | I195: Q3 | J195: 0.30280000000000001 | K195: =(100%-J195)/J195 -> 2.3025099075297226 | M195: J2 | N195: 0.28100000000000003 | O195: =(100%-N195)/N195 -> 2.5587188612099641
A196: A2 | B196: 0.35389999999999999 | C196: =(100%-B196)/B196 -> 1.8256569652444195 | E196: K3 | F196: 0.31919999999999998 | G196: =(100%-F196)/F196 -> 2.1328320802005014 | I196: Q2 | J196: 0.2944 | K196: =(100%-J196)/J196 -> 2.3967391304347827
E197: K2 | F197: 0.31080000000000002 | G197: =(100%-F197)/F197 -> 2.2175032175032174
A200: BU vs CO range: 18.9%- 22+, A2s+, A9o+, K9s+, KJo+, Q9s+, J9s+, T9s
B202: Equity | C202: Odds Needed
A203: 66 | B203: 0.50 | C203: =(100%-B203)/B203 -> 1
A204: 55 | B204: 0.47949999999999998 | C204: =(100%-B204)/B204 -> 1.0855057351407715
A205: 44 | B205: 0.45629999999999998 | C205: =(100%-B205)/B205 -> 1.1915406530791148
A206: 33 | B206: 0.43330000000000002 | C206: =(100%-B206)/B206 -> 1.3078698361412415
A207: 22 | B207: 0.41010000000000002 | C207: =(100%-B207)/B207 -> 1.4384296513045598
B210: Equity | C210: Odds Needed | F210: Equity | G210: Odds Needed | J210: Equity | K210: Odds Needed | N210: Equity | O210: Odds Needed | R210: Equity | S210: Odds Needed | V210: Equity | W210: Odds Needed | Z210: Equity | AA210: Odds Needed | AD210: Equity | AE210: Odds Needed
A211: ATs | B211: Favorite | E211: KQs | F211: 0.4703 | G211: =(100%-F211)/F211 -> 1.1263023601956199 | I211: QJs | J211: 0.4224 | K211: =(100%-J211)/J211 -> 1.3674242424242424 | M211: JTs | N211: 0.40949999999999998 | O211: =(100%-N211)/N211 -> 1.4420024420024422 | Q211: T9s | R211: 0.38719999999999999 | S211: =(100%-R211)/R211 -> 1.5826446280991737 | U211: 98s | V211: 0.38179999999999997 | W211: =(100%-V211)/V211 -> 1.6191723415400736 | Y211: 87s | Z211: 0.38119999999999998 | AA211: =(100%-Z211)/Z211 -> 1.6232948583420779 | AC211: 65s | AD211: 0.3669 | AE211: =(100%-AD211)/AD211 -> 1.7255382938130282
A212: A9s | B212: 0.46929999999999999 | C212: =(100%-B212)/B212 -> 1.1308331557639035 | E212: KJs | F212: 0.44040000000000001 | G212: =(100%-F212)/F212 -> 1.2706630336058129 | I212: QTs | J212: 0.41599999999999998 | K212: =(100%-J212)/J212 -> 1.4038461538461542 | M212: J9s | N212: 0.3851 | O212: =(100%-N212)/N212 -> 1.5967281225655674 | Q212: T8s | R212: 0.38019999999999998 | S212: =(100%-R212)/R212 -> 1.6301946344029459 | U212: 97s | V212: 0.36959999999999998 | W212: =(100%-V212)/V212 -> 1.7056277056277058 | Y212: 86s | Z212: 0.36899999999999999 | AA212: =(100%-Z212)/Z212 -> 1.7100271002710028 | AC212: 64s | AD212: 0.35060000000000002 | AE212: =(100%-AD212)/AD212 -> 1.8522532800912719
A213: A8s | B213: 0.44819999999999999 | C213: =(100%-B213)/B213 -> 1.2311468094600626 | E213: KTs | F213: 0.42230000000000001 | G213: =(100%-F213)/F213 -> 1.3679848448969927 | I213: Q9s | J213: 0.39129999999999998 | K213: =(100%-J213)/J213 -> 1.5555839509327882 | M213: J8s | N213: 0.37619999999999998 | O213: =(100%-N213)/N213 -> 1.6581605528973951 | Q213: T7s | R213: 0.36670000000000003 | S213: =(100%-R213)/R213 -> 1.7270248159258248 | U213: 96s | V213: 0.35649999999999998 | W213: =(100%-V213)/V213 -> 1.8050490883590462 | Y213: 85s | Z213: 0.35399999999999998 | AA213: =(100%-Z213)/Z213 -> 1.8248587570621471 | AC213: 63s | AD213: 0.3337 | AE213: =(100%-AD213)/AD213 -> 1.9967036260113875
A214: A7s | B214: 0.43819999999999998 | C214: =(100%-B214)/B214 -> 1.2820629849383844 | E214: K9s | F214: 0.39789999999999998 | G214: =(100%-F214)/F214 -> 1.5131942699170649 | I214: Q8s | J214: 0.38030000000000003 | K214: =(100%-J214)/J214 -> 1.6295030239284771 | M214: J7s | N214: 0.36320000000000002 | O214: =(100%-N214)/N214 -> 1.7533039647577093 | Q214: T6s | R214: 0.3533 | S214: =(100%-R214)/R214 -> 1.8304557033682425 | U214: 95s | V214: 0.34110000000000001 | W214: =(100%-V214)/V214 -> 1.931691586045148 | Y214: 84s | Z214: 0.33700000000000002 | AA214: =(100%-Z214)/Z214 -> 1.9673590504451037 | AC214: 62s | AD214: 0.31640000000000001 | AE214: =(100%-AD214)/AD214 -> 2.1605562579013906
A215: A6s | B215: 0.42720000000000002 | C215: =(100%-B215)/B215 -> 1.3408239700374531 | E215: K8s | F215: 0.38550000000000001 | G215: =(100%-F215)/F215 -> 1.5940337224383918 | I215: Q7s | J215: 0.3674 | K215: =(100%-J215)/J215 -> 1.7218290691344584 | M215: J6s | N215: 0.35 | O215: =(100%-N215)/N215 -> 1.8571428571428574 | Q215: T5s | R215: 0.33800000000000002 | S215: =(100%-R215)/R215 -> 1.9585798816568043 | U215: 94s | V215: 0.3241 | W215: =(100%-V215)/V215 -> 2.0854674483184201 | Y215: 83s | Z215: 0.3201 | AA215: =(100%-Z215)/Z215 -> 2.1240237425804436 | AC215: 54s | AD215: 0.35799999999999998 | AE215: =(100%-AD215)/AD215 -> 1.793296089385475
A216: A5s | B216: 0.4304 | C216: =(100%-B216)/B216 -> 1.3234200743494424 | E216: K7s | F216: 0.38350000000000001 | G216: =(100%-F216)/F216 -> 1.6075619295958279 | I216: Q6s | J216: 0.36609999999999998 | K216: =(100%-J216)/J216 -> 1.7314941272876265 | M216: J5s | N216: 0.34689999999999999 | O216: =(100%-N216)/N216 -> 1.8826751225136928 | Q216: T4s | R216: 0.33379999999999999 | S216: =(100%-R216)/R216 -> 1.9958058717795089 | U216: 93s | V216: 0.31979999999999997 | W216: =(100%-V216)/V216 -> 2.1269543464665417 | Y216: 82s | Z216: 0.31580000000000003 | AA216: =(100%-Z216)/Z216 -> 2.1665611146295118 | AC216: 53s | AD216: 0.34150000000000003 | AE216: =(100%-AD216)/AD216 -> 1.9282576866764274
A217: A4s | B217: 0.42209999999999998 | C217: =(100%-B217)/B217 -> 1.3691068467187872 | E217: K6s | F217: 0.37959999999999999 | G217: =(100%-F217)/F217 -> 1.6343519494204428 | I217: Q5s | J217: 0.36059999999999998 | K217: =(100%-J217)/J217 -> 1.7731558513588464 | M217: J4s | N217: 0.33989999999999998 | O217: =(100%-N217)/N217 -> 1.9420417769932334 | Q217: T3s | R217: 0.32679999999999998 | S217: =(100%-R217)/R217 -> 2.0599755201958385 | U217: 92s | V217: 0.31230000000000002 | W217: =(100%-V217)/V217 -> 2.202049311559398 | Y217: 76s | Z217: 0.37490000000000001 | AA217: =(100%-Z217)/Z217 -> 1.6673779674579887 | AC217: 52s | AD217: 0.3241 | AE217: =(100%-AD217)/AD217 -> 2.0854674483184201
A218: A3s | B218: 0.41510000000000002 | C218: =(100%-B218)/B218 -> 1.4090580582992049 | E218: K5s | F218: 0.37390000000000001 | G218: =(100%-F218)/F218 -> 1.6745119015779619 | I218: Q4s | J218: 0.35360000000000003 | K218: =(100%-J218)/J218 -> 1.8280542986425337 | M218: J3s | N218: 0.33279999999999998 | O218: =(100%-N218)/N218 -> 2.0048076923076925 | Q218: T2s | R218: 0.31940000000000002 | S218: =(100%-R218)/R218 -> 2.1308703819661865 | Y218: 75s | Z218: 0.36030000000000001 | AA218: =(100%-Z218)/Z218 -> 1.7754648903691366 | AC218: 43s | AD218: 0.3337 | AE218: =(100%-AD218)/AD218 -> 1.9967036260113875
A219: A2s | B219: 0.40770000000000001 | C219: =(100%-B219)/B219 -> 1.4527839097375521 | E219: K4s | F219: 0.3669 | G219: =(100%-F219)/F219 -> 1.7255382938130282 | I219: Q3s | J219: 0.34660000000000002 | K219: =(100%-J219)/J219 -> 1.8851702250432774 | M219: J2s | N219: 0.32540000000000002 | O219: =(100%-N219)/N219 -> 2.0731407498463428 | Y219: 74s | Z219: 0.34360000000000002 | AA219: =(100%-Z219)/Z219 -> 1.9103608847497089 | AC219: 42s | AD219: 0.3165 | AE219: =(100%-AD219)/AD219 -> 2.1595576619273302
E220: K3s | F220: 0.36 | G220: =(100%-F220)/F220 -> 1.7777777777777779 | I220: Q2s | J220: 0.3392 | K220: =(100%-J220)/J220 -> 1.9481132075471699 | Y220: 73s | Z220: 0.3266 | AA220: =(100%-Z220)/Z220 -> 2.061849357011635 | AC220: 32s | AD220: 0.30869999999999997 | AE220: =(100%-AD220)/AD220 -> 2.2393909944930357
E221: K2s | F221: 0.35260000000000002 | G221: =(100%-F221)/F221 -> 1.8360748723766305 | Y221: 72s | Z221: 0.30930000000000002 | AA221: =(100%-Z221)/Z221 -> 2.2331070158422244
B223: Equity | C223: Odds Needed | F223: Equity | G223: Odds Needed | J223: Equity | K223: Odds Needed | N223: Equity | O223: Odds Needed | R223: Equity | S223: Odds Needed | V223: Equity | W223: Odds Needed | Z223: Equity | AA223: Odds Needed | AD223: Equity | AE223: Odds Needed
A224: AT | B224: 0.48320000000000002 | C224: =(100%-B224)/B224 -> 1.0695364238410594 | E224: KQ | F224: 0.442 | G224: =(100%-F224)/F224 -> 1.2624434389140273 | I224: QJ | J224: 0.39100000000000001 | K224: =(100%-J224)/J224 -> 1.5575447570332479 | M224: JT | N224: 0.3775 | O224: =(100%-N224)/N224 -> 1.6490066225165565 | Q224: T9 | R224: 0.35370000000000001 | S224: =(100%-R224)/R224 -> 1.8272547356516822 | U224: 98 | V224: 0.34860000000000002 | W224: =(100%-V224)/V224 -> 1.8686173264486516 | Y224: 87 | Z224: 0.34849999999999998 | AA224: =(100%-Z224)/Z224 -> 1.8694404591104734 | AC224: 65 | AD224: 0.33360000000000001 | AE224: =(100%-AD224)/AD224 -> 1.9976019184652278
A225: A9 | B225: 0.44009999999999999 | C225: =(100%-B225)/B225 -> 1.2722108611679166 | E225: KJ | F225: 0.41010000000000002 | G225: =(100%-F225)/F225 -> 1.4384296513045598 | I225: QT | J225: 0.38400000000000001 | K225: =(100%-J225)/J225 -> 1.6041666666666665 | M225: J9 | N225: 0.3513 | O225: =(100%-N225)/N225 -> 1.846569883290635 | Q225: T8 | R225: 0.34689999999999999 | S225: =(100%-R225)/R225 -> 1.8826751225136928 | U225: 97 | V225: 0.3357 | W225: =(100%-V225)/V225 -> 1.9788501638367591 | Y225: 86 | Z225: 0.33560000000000001 | AA225: =(100%-Z225)/Z225 -> 1.9797377830750893 | AC225: 64 | AD225: 0.31619999999999998 | AE225: =(100%-AD225)/AD225 -> 2.1625553447185326
A226: A8 | B226: 0.41649999999999998 | C226: =(100%-B226)/B226 -> 1.4009603841536615 | E226: KT | F226: 0.39029999999999998 | G226: =(100%-F226)/F226 -> 1.5621316935690497 | I226: Q9 | J226: 0.3575 | K226: =(100%-J226)/J226 -> 1.7972027972027975 | M226: J8 | N226: 0.34229999999999999 | O226: =(100%-N226)/N226 -> 1.9214139643587496 | Q226: T7 | R226: 0.33260000000000001 | S226: =(100%-R226)/R226 -> 2.0066145520144318 | U226: 96 | V226: 0.32179999999999997 | W226: =(100%-V226)/V226 -> 2.1075201988812928 | Y226: 85 | Z226: 0.31969999999999998 | AA226: =(100%-Z226)/Z226 -> 2.1279324366593682 | AC226: 63 | AD226: 0.29820000000000002 | AE226: =(100%-AD226)/AD226 -> 2.3534540576794094
A227: A7 | B227: 0.40579999999999999 | C227: =(100%-B227)/B227 -> 1.464268112370626 | E227: K9 | F227: 0.36399999999999999 | G227: =(100%-F227)/F227 -> 1.7472527472527473 | I227: Q8 | J227: 0.34599999999999997 | K227: =(100%-J227)/J227 -> 1.8901734104046244 | M227: J7 | N227: 0.32850000000000001 | O227: =(100%-N227)/N227 -> 2.0441400304414001 | Q227: T6 | R227: 0.31840000000000002 | S227: =(100%-R227)/R227 -> 2.1407035175879394 | U227: 95 | V227: 0.30549999999999999 | W227: =(100%-V227)/V227 -> 2.2733224222585924 | Y227: 84 | Z227: 0.30170000000000002 | AA227: =(100%-Z227)/Z227 -> 2.3145508783559823 | AC227: 54 | AD227: 0.32419999999999999 | AE227: =(100%-AD227)/AD227 -> 2.084515731030228
A228: A6 | B228: 0.39400000000000002 | C228: =(100%-B228)/B228 -> 1.5380710659898476 | E228: K8 | F228: 0.3508 | G228: =(100%-F228)/F228 -> 1.8506271379703534 | I228: Q7 | J228: 0.33229999999999998 | K228: =(100%-J228)/J228 -> 2.0093289196509176 | M228: J6 | N228: 0.31430000000000002 | O228: =(100%-N228)/N228 -> 2.1816735602927135 | Q228: T5 | R228: 0.30230000000000001 | S228: =(100%-R228)/R228 -> 2.3079722130334104 | U228: 94 | V228: 0.28739999999999999 | W228: =(100%-V228)/V228 -> 2.4794711203897011 | Y228: 76 | Z228: 0.34200000000000003 | AA228: =(100%-Z228)/Z228 -> 1.9239766081871341 | AC228: 53 | AD228: 0.30669999999999997 | AE228: =(100%-AD228)/AD228 -> 2.2605151613955008
A229: A5 | B229: 0.3975 | C229: =(100%-B229)/B229 -> 1.5157232704402517 | E229: K7 | F229: 0.34870000000000001 | G229: =(100%-F229)/F229 -> 1.8677946659019213 | I229: Q6 | J229: 0.33100000000000002 | K229: =(100%-J229)/J229 -> 2.0211480362537766 | M229: J5 | N229: 0.31119999999999998 | O229: =(100%-N229)/N229 -> 2.2133676092544992 | Q229: T4 | R229: 0.29759999999999998 | S229: =(100%-R229)/R229 -> 2.360215053763441 | Y229: 75 | Z229: 0.32650000000000001 | AA229: =(100%-Z229)/Z229 -> 2.0627871362940273 | AC229: 52 | AD229: 0.28820000000000001 | AE229: =(100%-AD229)/AD229 -> 2.4698126301179735
A230: A4 | B230: 0.3886 | C230: =(100%-B230)/B230 -> 1.5733401955738546 | E230: K6 | F230: 0.34470000000000001 | G230: =(100%-F230)/F230 -> 1.901073397156948 | I230: Q5 | J230: 0.32519999999999999 | K230: =(100%-J230)/J230 -> 2.0750307503075032 | M230: J4 | N230: 0.30370000000000003 | O230: =(100%-N230)/N230 -> 2.2927230819888043 | Q230: T3 | R230: 0.29020000000000001 | S230: =(100%-R230)/R230 -> 2.4458993797381114 | Y230: 74 | Z230: 0.30869999999999997 | AA230: =(100%-Z230)/Z230 -> 2.2393909944930357 | AC230: 43 | AD230: 0.29849999999999999 | AE230: =(100%-AD230)/AD230 -> 2.3500837520938025
A231: A3 | B231: 0.38109999999999999 | C231: =(100%-B231)/B231 -> 1.6239832065074784 | E231: K5 | F231: 0.33860000000000001 | G231: =(100%-F231)/F231 -> 1.9533372711163615 | I231: Q4 | J231: 0.31780000000000003 | K231: =(100%-J231)/J231 -> 2.1466331025802385 | M231: J3 | N231: 0.29620000000000002 | O231: =(100%-N231)/N231 -> 2.3760972316002698 | Q231: T2 | R231: 0.28220000000000001 | S231: =(100%-R231)/R231 -> 2.5435861091424519 | Y231: 73 | Z231: 0.29059999999999997 | AA231: =(100%-Z231)/Z231 -> 2.4411562284927739
A232: A2 | B232: 0.37309999999999999 | C232: =(100%-B232)/B232 -> 1.6802465826856072 | E232: K4 | F232: 0.33110000000000001 | G232: =(100%-F232)/F232 -> 2.0202355783751136 | I232: Q3 | J232: 0.31019999999999998 | K232: =(100%-J232)/J232 -> 2.2237266279819474 | M232: J2 | N232: 0.28820000000000001 | O232: =(100%-N232)/N232 -> 2.4698126301179735
E233: K3 | F233: 0.32369999999999999 | G233: =(100%-F233)/F233 -> 2.0892801977139328 | I233: Q2 | J233: 0.30230000000000001 | K233: =(100%-J233)/J233 -> 2.3079722130334104
E234: K2 | F234: 0.31590000000000001 | G234: =(100%-F234)/F234 -> 2.1655587211142762
A237: Loose Range (SB and BB vs. BU - Might be a bit tighter than this): 30%- Any pair, Any Ace, Any broadway, K9s, Q9s, J9s, T8s+, 98s, 87s, 76s.
B239: Equity | C239: Odds Needed
A240: 44 | B240: 0.49340000000000001 | C240: =(100%-B240)/B240 -> 1.0267531414673692
A241: 33 | B241: 0.4713 | C241: =(100%-B241)/B241 -> 1.121790791427965
A242: 22 | B242: 0.44890000000000002 | C242: =(100%-B242)/B242 -> 1.227667631989307
B244: Equity | C244: Odds Needed | F244: Equity | G244: Odds Needed | J244: Equity | K244: Odds Needed | N244: Equity | O244: Odds Needed | R244: Equity | S244: Odds Needed | V244: Equity | W244: Odds Needed | Z244: Equity | AA244: Odds Needed | AD244: Equity | AE244: Odds Needed
A245: A7s | B245: 0.49259999999999998 | C245: =(100%-B245)/B245 -> 1.0300446609825418 | E245: KJs | F245: 0.48230000000000001 | G245: =(100%-F245)/F245 -> 1.0733982998133942 | I245: QJs | J245: 0.46139999999999998 | K245: =(100%-J245)/J245 -> 1.1673168617251841 | M245: JTs | N245: 0.43159999999999998 | O245: =(100%-N245)/N245 -> 1.3169601482854496 | Q245: T9s | R245: 0.41320000000000001 | S245: =(100%-R245)/R245 -> 1.4201355275895449 | U245: 98s | V245: 0.405 | W245: =(100%-V245)/V245 -> 1.4691358024691357 | Y245: 87s | Z245: 0.3982 | AA245: =(100%-Z245)/Z245 -> 1.5113008538422903 | AC245: 65s | AD245: 0.38159999999999999 | AE245: =(100%-AD245)/AD245 -> 1.6205450733752622
A246: A6s | B246: 0.4738 | C246: =(100%-B246)/B246 -> 1.1105951878429716 | E246: KTs | F246: 0.46439999999999998 | G246: =(100%-F246)/F246 -> 1.1533161068044791 | I246: QTs | J246: 0.44330000000000003 | K246: =(100%-J246)/J246 -> 1.2558087074216104 | M246: J9s | N246: 0.41199999999999998 | O246: =(100%-N246)/N246 -> 1.4271844660194177 | Q246: T8s | R246: 0.39979999999999999 | S246: =(100%-R246)/R246 -> 1.5012506253126565 | U246: 97s | V246: 0.39190000000000003 | W246: =(100%-V246)/V246 -> 1.5516713447307986 | Y246: 86s | Z246: 0.38550000000000001 | AA246: =(100%-Z246)/Z246 -> 1.5940337224383918 | AC246: 64s | AD246: 0.36620000000000003 | AE246: =(100%-AD246)/AD246 -> 1.7307482250136534
A247: A5s | B247: 0.47099999999999997 | C247: =(100%-B247)/B247 -> 1.1231422505307858 | E247: K9s | F247: 0.43540000000000001 | G247: =(100%-F247)/F247 -> 1.2967386311437759 | I247: Q9s | J247: 0.41920000000000002 | K247: =(100%-J247)/J247 -> 1.3854961832061068 | M247: J8s | N247: 0.39889999999999998 | O247: =(100%-N247)/N247 -> 1.5068939583855603 | Q247: T7s | R247: 0.385 | S247: =(100%-R247)/R247 -> 1.5974025974025974 | U247: 96s | V247: 0.37909999999999999 | W247: =(100%-V247)/V247 -> 1.6378264310208388 | Y247: 85s | Z247: 0.36990000000000001 | AA247: =(100%-Z247)/Z247 -> 1.7034333603676668 | AC247: 63s | AD247: 0.34960000000000002 | AE247: =(100%-AD247)/AD247 -> 1.860411899313501
A248: A4s | B248: 0.46100000000000002 | C248: =(100%-B248)/B248 -> 1.1691973969631235 | E248: K8s | F248: 0.41980000000000001 | G248: =(100%-F248)/F248 -> 1.3820867079561696 | I248: Q8s | J248: 0.405 | K248: =(100%-J248)/J248 -> 1.4691358024691357 | M248: J7s | N248: 0.385 | O248: =(100%-N248)/N248 -> 1.5974025974025974 | Q248: T6s | R248: 0.37180000000000002 | S248: =(100%-R248)/R248 -> 1.6896180742334588 | U248: 95s | V248: 0.36330000000000001 | W248: =(100%-V248)/V248 -> 1.7525461051472613 | Y248: 84s | Z248: 0.35360000000000003 | AA248: =(100%-Z248)/Z248 -> 1.8280542986425337 | AC248: 62s | AD248: 0.33260000000000001 | AE248: =(100%-AD248)/AD248 -> 2.0066145520144318
A249: A3s | B249: 0.45429999999999998 | C249: =(100%-B249)/B249 -> 1.2011886418666082 | E249: K7s | F249: 0.4163 | G249: =(100%-F249)/F249 -> 1.4021138601969734 | I249: Q7s | J249: 0.39100000000000001 | K249: =(100%-J249)/J249 -> 1.5575447570332479 | M249: J6s | N249: 0.37190000000000001 | O249: =(100%-N249)/N249 -> 1.6888948642108093 | Q249: T5s | R249: 0.35599999999999998 | S249: =(100%-R249)/R249 -> 1.808988764044944 | U249: 94s | V249: 0.3468 | W249: =(100%-V249)/V249 -> 1.8835063437139561 | Y249: 83s | Z249: 0.33710000000000001 | AA249: =(100%-Z249)/Z249 -> 1.9664787896766538 | AC249: 54s | AD249: 0.37419999999999998 | AE249: =(100%-AD249)/AD249 -> 1.6723677177979692
A250: A2s | B250: 0.4475 | C250: =(100%-B250)/B250 -> 1.2346368715083798 | E250: K6s | F250: 0.41 | G250: =(100%-F250)/F250 -> 1.4390243902439028 | I250: Q6s | J250: 0.38950000000000001 | K250: =(100%-J250)/J250 -> 1.5673940949935816 | M250: J5s | N250: 0.36820000000000003 | O250: =(100%-N250)/N250 -> 1.7159152634437802 | Q250: T4s | R250: 0.35210000000000002 | S250: =(100%-R250)/R250 -> 1.8401022436807721 | U250: 93s | V250: 0.34300000000000003 | W250: =(100%-V250)/V250 -> 1.9154518950437318 | Y250: 82s | Z250: 0.3332 | AA250: =(100%-Z250)/Z250 -> 2.0012004801920771 | AC250: 53s | AD250: 0.3579 | AE250: =(100%-AD250)/AD250 -> 1.7940765576976809
E251: K5s | F251: 0.41210000000000002 | G251: =(100%-F251)/F251 -> 1.4265954865323949 | I251: Q5s | J251: 0.3831 | K251: =(100%-J251)/J251 -> 1.6102845210127905 | M251: J4s | N251: 0.3619 | O251: =(100%-N251)/N251 -> 1.7631942525559547 | Q251: T3s | R251: 0.34539999999999998 | S251: =(100%-R251)/R251 -> 1.8951939779965261 | U251: 92s | V251: 0.33629999999999999 | W251: =(100%-V251)/V251 -> 1.9735355337496283 | Y251: 76s | Z251: 0.39019999999999999 | AA251: =(100%-Z251)/Z251 -> 1.5627883136852896 | AC251: 52s | AD251: 0.34100000000000003 | AE251: =(100%-AD251)/AD251 -> 1.9325513196480937
E252: K4s | F252: 0.3992 | G252: =(100%-F252)/F252 -> 1.5050100200400802 | I252: Q4s | J252: 0.37680000000000002 | K252: =(100%-J252)/J252 -> 1.6539278131634818 | M252: J3s | N252: 0.35520000000000002 | O252: =(100%-N252)/N252 -> 1.8153153153153154 | Q252: T2s | R252: 0.33860000000000001 | S252: =(100%-R252)/R252 -> 1.9533372711163615 | Y252: 75s | Z252: 0.37490000000000001 | AA252: =(100%-Z252)/Z252 -> 1.6673779674579887 | AC252: 43s | AD252: 0.35099999999999998 | AE252: =(100%-AD252)/AD252 -> 1.8490028490028492
E253: K3s | F253: 0.39290000000000003 | G253: =(100%-F253)/F253 -> 1.5451768897938405 | I253: Q3s | J253: 0.37030000000000002 | K253: =(100%-J253)/J253 -> 1.7005130974885225 | M253: J2s | N253: 0.34849999999999998 | O253: =(100%-N253)/N253 -> 1.8694404591104734 | Y253: 74s | Z253: 0.3589 | AA253: =(100%-Z253)/Z253 -> 1.7862914460852606 | AC253: 42s | AD253: 0.33439999999999998 | AE253: =(100%-AD253)/AD253 -> 1.9904306220095693
E254: K2s | F254: 0.3866 | G254: =(100%-F254)/F254 -> 1.5866528711846868 | I254: Q2s | J254: 0.36370000000000002 | K254: =(100%-J254)/J254 -> 1.7495188342040142 | Y254: 73s | Z254: 0.34229999999999999 | AA254: =(100%-Z254)/Z254 -> 1.9214139643587496 | AC254: 32s | AD254: 0.32719999999999999 | AE254: =(100%-AD254)/AD254 -> 2.0562347188264063
Y255: 72s | Z255: 0.3256 | AA255: =(100%-Z255)/Z255 -> 2.0712530712530715
B257: Equity | C257: Odds Needed | F257: Equity | G257: Odds Needed | J257: Equity | K257: Odds Needed | N257: Equity | O257: Odds Needed | R257: Equity | S257: Odds Needed | V257: Equity | W257: Odds Needed | Z257: Equity | AA257: Odds Needed | AD257: Equity | AE257: Odds Needed
A258: A8 | B258: 0.48659999999999998 | C258: =(100%-B258)/B258 -> 1.0550760378133992 | E258: KQ | F258: 0.4738 | G258: =(100%-F258)/F258 -> 1.1105951878429716 | I258: QJ | J258: 0.43159999999999998 | K258: =(100%-J258)/J258 -> 1.3169601482854496 | M258: JT | N258: 0.40010000000000001 | O258: =(100%-N258)/N258 -> 1.4993751562109472 | Q258: T9 | R258: 0.38019999999999998 | S258: =(100%-R258)/R258 -> 1.6301946344029459 | U258: 98 | V258: 0.37159999999999999 | W258: =(100%-V258)/V258 -> 1.6910656620021531 | Y258: 87 | Z258: 0.36480000000000001 | AA258: =(100%-Z258)/Z258 -> 1.7412280701754386 | AC258: 65 | AD258: 0.34770000000000001 | AE258: =(100%-AD258)/AD258 -> 1.8760425654299684
A259: A7 | B259: 0.46410000000000001 | C259: =(100%-B259)/B259 -> 1.1547080370609784 | E259: KJ | F259: 0.4536 | G259: =(100%-F259)/F259 -> 1.2045855379188712 | I259: QT | J259: 0.4123 | K259: =(100%-J259)/J259 -> 1.4254183846713557 | M259: J9 | N259: 0.37859999999999999 | O259: =(100%-N259)/N259 -> 1.641310089804543 | Q259: T8 | R259: 0.36609999999999998 | S259: =(100%-R259)/R259 -> 1.7314941272876265 | U259: 97 | V259: 0.35809999999999997 | W259: =(100%-V259)/V259 -> 1.7925160569673277 | Y259: 86 | Z259: 0.35149999999999998 | AA259: =(100%-Z259)/Z259 -> 1.8449502133712663 | AC259: 64 | AD259: 0.33129999999999998 | AE259: =(100%-AD259)/AD259 -> 2.0184123151222462
A260: A6 | B260: 0.44379999999999997 | C260: =(100%-B260)/B260 -> 1.253267237494367 | E260: KT | F260: 0.4345 | G260: =(100%-F260)/F260 -> 1.3014959723820483 | I260: Q9 | J260: 0.3861 | K260: =(100%-J260)/J260 -> 1.59000259000259 | M260: J8 | N260: 0.36509999999999998 | O260: =(100%-N260)/N260 -> 1.7389756231169544 | Q260: T7 | R260: 0.35060000000000002 | S260: =(100%-R260)/R260 -> 1.8522532800912719 | U260: 96 | V260: 0.34429999999999999 | W260: =(100%-V260)/V260 -> 1.904443799012489 | Y260: 85 | Z260: 0.33489999999999998 | AA260: =(100%-Z260)/Z260 -> 1.9859659599880564 | AC260: 63 | AD260: 0.3135 | AE260: =(100%-AD260)/AD260 -> 2.1897926634768741
A261: A5 | B261: 0.44080000000000003 | C261: =(100%-B261)/B261 -> 1.2686025408348456 | E261: K9 | F261: 0.4032 | G261: =(100%-F261)/F261 -> 1.4801587301587302 | I261: Q8 | J261: 0.37119999999999997 | K261: =(100%-J261)/J261 -> 1.6939655172413795 | M261: J7 | N261: 0.35020000000000001 | O261: =(100%-N261)/N261 -> 1.855511136493432 | Q261: T6 | R261: 0.33639999999999998 | S261: =(100%-R261)/R261 -> 1.9726516052318668 | U261: 95 | V261: 0.32740000000000002 | W261: =(100%-V261)/V261 -> 2.0543677458766032 | Y261: 84 | Z261: 0.31740000000000002 | AA261: =(100%-Z261)/Z261 -> 2.15059861373661 | AC261: 62 | AD261: 0.29530000000000001 | AE261: =(100%-AD261)/AD261 -> 2.3863867253640363
A262: A4 | B262: 0.43009999999999998 | C262: =(100%-B262)/B262 -> 1.325040688212044 | E262: K8 | F262: 0.3866 | G262: =(100%-F262)/F262 -> 1.5866528711846868 | I262: Q7 | J262: 0.35620000000000002 | K262: =(100%-J262)/J262 -> 1.8074115665356538 | M262: J6 | N262: 0.3362 | O262: =(100%-N262)/N262 -> 1.9744199881023199 | Q262: T5 | R262: 0.31950000000000001 | S262: =(100%-R262)/R262 -> 2.1298904538341157 | U262: 94 | V262: 0.30980000000000002 | W262: =(100%-V262)/V262 -> 2.2278889606197545 | Y262: 83 | Z262: 0.29970000000000002 | AA262: =(100%-Z262)/Z262 -> 2.3366700033366694 | AC262: 54 | AD262: 0.34 | AE262: =(100%-AD262)/AD262 -> 1.9411764705882348
A263: A3 | B263: 0.4229 | C263: =(100%-B263)/B263 -> 1.3646252069047056 | E263: K7 | F263: 0.38279999999999997 | G263: =(100%-F263)/F263 -> 1.612330198537095 | I263: Q6 | J263: 0.35449999999999998 | K263: =(100%-J263)/J263 -> 1.8208744710860367 | M263: J5 | N263: 0.3322 | O263: =(100%-N263)/N263 -> 2.0102347983142685 | Q263: T4 | R263: 0.31530000000000002 | S263: =(100%-R263)/R263 -> 2.1715826197272436 | U263: 93 | V263: 0.30570000000000003 | W263: =(100%-V263)/V263 -> 2.2711808963035649 | Y263: 82 | Z263: 0.29559999999999997 | AA263: =(100%-Z263)/Z263 -> 2.3829499323410017 | AC263: 53 | AD263: 0.3225 | AE263: =(100%-AD263)/AD263 -> 2.1007751937984493
A264: A2 | B264: 0.41560000000000002 | C264: =(100%-B264)/B264 -> 1.4061597690086622 | E264: K6 | F264: 0.37819999999999998 | G264: =(100%-F264)/F264 -> 1.6441036488630356 | I264: Q5 | J264: 0.34770000000000001 | K264: =(100%-J264)/J264 -> 1.8760425654299684 | M264: J4 | N264: 0.32540000000000002 | O264: =(100%-N264)/N264 -> 2.0731407498463428 | Q264: T3 | R264: 0.30809999999999998 | S264: =(100%-R264)/R264 -> 2.2456994482310937 | U264: 92 | V264: 0.29849999999999999 | W264: =(100%-V264)/V264 -> 2.3500837520938025 | Y264: 76 | Z264: 0.35639999999999999 | AA264: =(100%-Z264)/Z264 -> 1.8058361391694724 | AC264: 52 | AD264: 0.30449999999999999 | AE264: =(100%-AD264)/AD264 -> 2.284072249589491
E265: K5 | F265: 0.37109999999999999 | G265: =(100%-F265)/F265 -> 1.6946914578280787 | I265: Q4 | J265: 0.34100000000000003 | K265: =(100%-J265)/J265 -> 1.9325513196480937 | M265: J3 | N265: 0.31819999999999998 | O265: =(100%-N265)/N265 -> 2.1426775612822127 | Q265: T2 | R265: 0.30070000000000002 | S265: =(100%-R265)/R265 -> 2.3255736614566014 | Y265: 75 | Z265: 0.34050000000000002 | AA265: =(100%-Z265)/Z265 -> 1.9368575624082229 | AC265: 43 | AD265: 0.31530000000000002 | AE265: =(100%-AD265)/AD265 -> 2.1715826197272436
E266: K4 | F266: 0.3644 | G266: =(100%-F266)/F266 -> 1.74423710208562 | I266: Q3 | J266: 0.33389999999999997 | K266: =(100%-J266)/J266 -> 1.994908655286014 | M266: J2 | N266: 0.31090000000000001 | O266: =(100%-N266)/N266 -> 2.2164683177870699 | Y266: 74 | Z266: 0.32340000000000002 | AA266: =(100%-Z266)/Z266 -> 2.0921459492888062 | AC266: 42 | AD266: 0.2975 | AE266: =(100%-AD266)/AD266 -> 2.3613445378151261
E267: K3 | F267: 0.35770000000000002 | G267: =(100%-F267)/F267 -> 1.795638803466592 | I267: Q2 | J267: 0.32679999999999998 | K267: =(100%-J267)/J267 -> 2.0599755201958385 | Y267: 73 | Z267: 0.30559999999999998 | AA267: =(100%-Z267)/Z267 -> 2.2722513089005236 | AC267: 32 | AD267: 0.2898 | AE267: =(100%-AD267)/AD267 -> 2.4506556245686677
E268: K2 | F268: 0.3508 | G268: =(100%-F268)/F268 -> 1.8506271379703534 | Y268: 72 | Z268: 0.28760000000000002 | AA268: =(100%-Z268)/Z268 -> 2.4770514603616127
A270: 81.9%- usually a short stack of les than 10BB on the SB: All pairs, All aces, All kings, All queens, All suited cards, All jacks, T6o+, 95o+, conectors 54+, one gap 64+, two gaps 85o+.
B272: Equity | C272: Odds Needed
A273: 22 | B273: 0.49130000000000001 | C273: =(100%-B274)/B274 -> 1.035416242621616
B275: Equity | C275: Odds Needed | F275: Equity | G275: Odds Needed | J275: Equity | K275: Odds Needed | N275: Equity | O275: Odds Needed | R275: Equity | S275: Odds Needed | V275: Equity | W275: Odds Needed | Z275: Equity | AA275: Odds Needed | AD275: Equity | AE275: Odds Needed | AH275: Equity | AI275: Odds Needed | AL275: Equity | AM275: Odds Needed
B276: All Aces are favorite | F276: All Kings suited are Favorite | I276: Q5s | J276: 0.4955 | K276: =(100%-J277)/J277 -> 1.0181634712411705 | M276: J7s | N276: 0.48759999999999998 | O276: =(100%-N277)/N277 -> 1.0508613617719442 | Q276: T8s | R276: 0.48630000000000001 | S276: =(100%-R277)/R277 -> 1.056343820686819 | U276: 98s | V276: 0.47589999999999999 | W276: =(100%-V277)/V277 -> 1.1012817818869511 | Y276: 87s | Z276: 0.45 | AA276: =(100%-Z277)/Z277 -> 1.2222222222222223 | AC276: 76s | AD276: 0.42770000000000002 | AE276: =(100%-AD277)/AD277 -> 1.3380874444704232 | AG276: 65s | AH276: 0.40920000000000001 | AI276: =(100%-AH277)/AH277 -> 1.4437927663734116 | AK276: 54s | AL276: 0.39800000000000002 | AM276: =(100%-AL277)/AL277 -> 1.5125628140703515
I277: Q4s | J277: 0.48480000000000001 | K277: =(100%-J278)/J278 -> 1.0627062706270627 | M277: J6s | N277: 0.46910000000000002 | O277: =(100%-N278)/N278 -> 1.1317416329140906 | Q277: T7s | R277: 0.46860000000000002 | S277: =(100%-R278)/R278 -> 1.1340162185232607 | U277: 97s | V277: 0.45850000000000002 | W277: =(100%-V278)/V278 -> 1.1810250817884405 | Y277: 86s | Z277: 0.43269999999999997 | AA277: =(100%-Z278)/Z278 -> 1.3110700254217704 | AC277: 75s | AD277: 0.41170000000000001 | AE277: =(100%-AD278)/AD278 -> 1.4289531212047608 | AG277: 64s | AH277: 0.39439999999999997 | AI277: =(100%-AH278)/AH278 -> 1.5354969574036512 | AK277: 53s | AL277: 0.38290000000000002 | AM277: =(100%-AL278)/AL278 -> 1.6116479498563592
I278: Q3s | J278: 0.47660000000000002 | K278: =(100%-J279)/J279 -> 1.0981955518254301 | M278: J5s | N278: 0.46129999999999999 | O278: =(100%-N279)/N279 -> 1.1677866897897247 | Q278: T6s | R278: 0.45119999999999999 | S278: =(100%-R279)/R279 -> 1.2163120567375887 | U278: 96s | V278: 0.441 | W278: =(100%-V279)/V279 -> 1.2675736961451245 | Y278: 85s | Z278: 0.4163 | AA278: =(100%-Z279)/Z279 -> 1.4021138601969734 | AC278: 74s | AD278: 0.3962 | AE278: =(100%-AD279)/AD279 -> 1.5239777889954569 | AG278: 63s | AH278: 0.37780000000000002 | AI278: =(100%-AH279)/AH279 -> 1.6469031233456855 | AK278: 52s | AL278: 0.36620000000000003 | AM278: =(100%-AL279)/AL279 -> 1.7307482250136534
I279: Q2s | J279: 0.46970000000000001 | K279: =(100%-J280)/J280 -> 1.1290185224611453 | M279: J4s | N279: 0.45100000000000001 | O279: =(100%-N280)/N280 -> 1.2172949002217293 | Q279: T5s | R279: 0.43419999999999997 | S279: =(100%-R280)/R280 -> 1.3030861354214651 | U279: 95s | V279: 0.42430000000000001 | W279: =(100%-V280)/V280 -> 1.3568230025925052 | Y279: 84s | Z279: 0.3997 | AA279: =(100%-Z280)/Z280 -> 1.5018764073054793 | AC279: 73s | AD279: 0.37919999999999998 | AE279: =(100%-AD280)/AD280 -> 1.6371308016877639 | AG279: 62s | AH279: 0.3609 | AI279: =(100%-AH280)/AH280 -> 1.7708506511499029 | AK279: 43s | AL279: 0.376 | AM279: =(100%-AL280)/AL280 -> 1.6595744680851063
M280: J3s | N280: 0.443 | O280: =(100%-N281)/N281 -> 1.2573363431151241 | Q280: T4s | R280: 0.42770000000000002 | S280: =(100%-R281)/R281 -> 1.3380874444704232 | U280: 94s | V280: 0.40629999999999999 | W280: =(100%-V281)/V281 -> 1.4612355402412012 | Y280: 83s | Z280: 0.3826 | AA280: =(100%-Z281)/Z281 -> 1.6136957658128592 | AC280: 72s | AD280: 0.36230000000000001 | AE280: =(100%-AD281)/AD281 -> 1.7601435274634278 | AK280: 42s | AL280: 0.35870000000000002 | AM280: =(100%-AL281)/AL281 -> 1.7878449958182323
M281: J2s | N281: 0.43609999999999999 | O281: =(100%-N282)/N282 -> 1.2930520522815869 | Q281: T3s | R281: 0.42009999999999997 | S281: =(100%-R282)/R282 -> 1.3803856224708406 | U281: 93s | V281: 0.40139999999999998 | W281: =(100%-V282)/V282 -> 1.491280518186348 | Y281: 82s | Z281: 0.37830000000000003 | AA281: =(100%-Z282)/Z282 -> 1.6434047052603751 | AK281: 32s | AL281: 0.35370000000000001 | AM281: =(100%-AL282)/AL282 -> 1.8272547356516822
Q282: T2s | R282: 0.4133 | S282: =(100%-R283)/R283 -> 1.4195499637067506 | U282: 92s | V282: 0.39460000000000001 | W282: =(100%-V283)/V283 -> 1.5342118601115051
B284: Equity | C284: Odds Needed | F284: Equity | G284: Odds Needed | J284: Equity | K284: Odds Needed | N284: Equity | O284: Odds Needed | R284: Equity | S284: Odds Needed | V284: Equity | W284: Odds Needed | Z284: Equity | AA284: Odds Needed | AD284: Equity | AE284: Odds Needed | AH284: Equity | AI284: Odds Needed | AL284: Equity | AM284: Odds Needed
B285: All Aces are favorite | E285: K4 | F285: 0.49419999999999997 | G285: =(100%-F286)/F286 -> 1.0234722784297856 | I285: Q7 | J285: 0.48580000000000001 | K285: =(100%-J286)/J286 -> 1.0584602717167557 | M285: J9 | N285: 0.49819999999999998 | O285: =(100%-N286)/N286 -> 1.0072260136491369 | Q285: T9 | R285: 0.47710000000000002 | S285: =(100%-R286)/R286 -> 1.0959966464053654 | U285: 98 | V285: 0.44679999999999997 | W285: =(100%-V286)/V286 -> 1.2381378692927485 | Y285: 87 | Z285: 0.4194 | AA285: =(100%-Z286)/Z286 -> 1.3843586075345733 | AC285: 76 | AD285: 0.3957 | AE285: =(100%-AD286)/AD286 -> 1.5271670457417237 | AG285: 65 | AH285: 0.37609999999999999 | AI285: =(100%-AH286)/AH286 -> 1.6588673225206063 | AK285: 54 | AL285: 0.36420000000000002 | AM285: =(100%-AL286)/AL286 -> 1.7457440966501918
E286: K3 | F286: 0.48509999999999998 | G286: =(100%-F287)/F287 -> 1.0614306328592045 | I286: Q6 | J286: 0.47760000000000002 | K286: =(100%-J287)/J287 -> 1.0938023450586263 | M286: J8 | N286: 0.47860000000000003 | O286: =(100%-N287)/N287 -> 1.0894274968658586 | Q286: T8 | R286: 0.4577 | S286: =(100%-R287)/R287 -> 1.1848372296263929 | U286: 97 | V286: 0.42809999999999998 | W286: =(100%-V287)/V287 -> 1.3359028264424202 | Y286: 86 | Z286: 0.40089999999999998 | AA286: =(100%-Z287)/Z287 -> 1.494387627837366 | AC286: 75 | AD286: 0.37859999999999999 | AE286: =(100%-AD287)/AD287 -> 1.641310089804543 | AG286: 64 | AH286: 0.36009999999999998 | AI286: =(100%-AH287)/AH287 -> 1.7770063871146906 | AK286: 53 | AL286: 0.34789999999999999 | AM286: =(100%-AL287)/AL287 -> 1.8743891922966371
E287: K2 | F287: 0.4778 | G287: =(100%-F288)/F288 -> 1.0929259104227711 | I287: Q5 | J287: 0.4667 | K287: =(100%-J288)/J288 -> 1.1427040925648169 | M287: J7 | N287: 0.4587 | O287: =(100%-N288)/N288 -> 1.1800741225201656 | Q287: T7 | R287: 0.43869999999999998 | S287: =(100%-R288)/R288 -> 1.2794620469569182 | U287: 96 | V287: 0.40949999999999998 | W287: =(100%-V288)/V288 -> 1.4420024420024422 | Y287: 85 | Z287: 0.38329999999999997 | AA287: =(100%-Z288)/Z288 -> 1.6089225150013047 | AC287: 74 | AD287: 0.36180000000000001 | AE287: =(100%-AD288)/AD288 -> 1.7639579878385847 | AG287: 63 | AH287: 0.3422 | AI287: =(100%-AH288)/AH288 -> 1.922267679719462 | AK287: 52 | AL287: 0.32990000000000003 | AM287: =(100%-AL288)/AL288 -> 2.0312215822976656
I288: Q4 | J288: 0.45519999999999999 | K288: =(100%-J289)/J289 -> 1.1968365553602811 | M288: J6 | N288: 0.43890000000000001 | O288: =(100%-N289)/N289 -> 1.2784233310549098 | Q288: T6 | R288: 0.42009999999999997 | S288: =(100%-R289)/R289 -> 1.3803856224708406 | U288: 95 | V288: 0.3916 | W288: =(100%-V289)/V289 -> 1.5536261491317673 | Y288: 84 | Z288: 0.36530000000000001 | AA288: =(100%-Z289)/Z289 -> 1.737476047084588 | AC288: 73 | AD288: 0.34350000000000003 | AE288: =(100%-AD289)/AD289 -> 1.9112081513828236 | AG288: 62 | AH288: 0.3241 | AI288: =(100%-AH289)/AH289 -> 2.0854674483184201 | AK288: 43 | AL288: 0.34050000000000002 | AM288: =(100%-AL289)/AL289 -> 1.9368575624082229
I289: Q3 | J289: 0.44629999999999997 | K289: =(100%-J290)/J290 -> 1.2406453058480844 | M289: J5 | N289: 0.43049999999999999 | O289: =(100%-N290)/N290 -> 1.3228803716608595 | Q289: T5 | R289: 0.40179999999999999 | S289: =(100%-R290)/R290 -> 1.488800398208064 | U289: 94 | V289: 0.37219999999999998 | W289: =(100%-V290)/V290 -> 1.6867275658248255 | Y289: 83 | Z289: 0.34689999999999999 | AA289: =(100%-Z290)/Z290 -> 1.8826751225136928 | AC289: 72 | AD289: 0.32540000000000002 | AE289: =(100%-AD290)/AD290 -> 2.0731407498463428 | AK289: 42 | AL289: 0.32300000000000001 | AM289: =(100%-AL290)/AL290 -> 2.0959752321981426
I290: Q2 | J290: 0.43880000000000002 | K290: =(100%-J291)/J291 -> 1.2789425706472195 | M290: J4 | N290: 0.4194 | O290: =(100%-N291)/N291 -> 1.3843586075345733 | Q290: T4 | R290: 0.39479999999999998 | S290: =(100%-R291)/R291 -> 1.5329280648429584 | U290: 93 | V290: 0.36680000000000001 | W290: =(100%-V291)/V291 -> 1.7262813522355507 | Y290: 82 | Z290: 0.34229999999999999 | AA290: =(100%-Z291)/Z291 -> 1.9214139643587496 | AK290: 32 | AL290: 0.31659999999999999 | AM290: =(100%-AL291)/AL291 -> 2.1585596967782692
M291: J3 | N291: 0.4108 | O291: =(100%-N292)/N292 -> 1.4342745861733202 | Q291: T3 | R291: 0.3866 | S291: =(100%-R292)/R292 -> 1.5866528711846868 | U291: 92 | V291: 0.35949999999999999 | W291: =(100%-V292)/V292 -> 1.781641168289291
M292: J2 | N292: 0.40329999999999999 | O292: =(100%-N293)/N293 -> 1.4795437639474338 | Q292: T2 | R292: 0.37919999999999998 | S292: =(100%-R293)/R293 -> 1.6371308016877639